"No.","Time","Source","Destination","Protocol","Length","Port","Lenght TCP","Info"
"2","1.519133","10.0.0.101","192.168.0.3","RSL","602","5000,35644","536","CHANnel ReQuireD "
"3","1.519265","192.168.0.3","10.0.0.101","TCP","66","35644,5000","0","35644  >  5000 [ACK] Seq=1 Ack=537 Win=29004 Len=0 TSval=1654345257 TSecr=1785877850"
"5","3.433870","192.168.0.3","10.0.0.101","RSL","602","35644,5000","536","CHANnel ReQuireD "
"6","3.449317","10.0.0.101","192.168.0.3","TCP","66","5000,35644","0","5000  >  35644 [ACK] Seq=537 Ack=537 Win=16088 Len=0 TSval=1785879775 TSecr=1654347172"
"7","3.459370","10.0.0.101","192.168.0.3","RSL","602","5000,35644","536","CHANnel ReQuireD "
"8","3.459431","192.168.0.3","10.0.0.101","TCP","66","35644,5000","0","35644  >  5000 [ACK] Seq=537 Ack=1073 Win=29014 Len=0 TSval=1654347197 TSecr=1785879787"
"9","3.460004","192.168.0.3","10.0.0.101","RSL","602","35644,5000","536","CHANnel ReQuireD "
"10","3.479502","10.0.0.101","192.168.0.3","TCP","66","5000,35644","0","5000  >  35644 [ACK] Seq=1073 Ack=1073 Win=16088 Len=0 TSval=1785879805 TSecr=1654347198"
"11","3.489581","10.0.0.101","192.168.0.3","RSL CBCH","1514","5000,35644","1448","SMS BroadCast REQuest "
"12","3.489608","10.0.0.101","192.168.0.3","TCP","182","5000,35644","116","5000  >  35644 [PSH, ACK] Seq=2521 Ack=1073 Win=16088 Len=116 TSval=1785879817 TSecr=1654347198"
"13","3.489658","192.168.0.3","10.0.0.101","TCP","66","35644,5000","0","35644  >  5000 [ACK] Seq=1073 Ack=2637 Win=28998 Len=0 TSval=1654347228 TSecr=1785879817"
"14","3.499652","10.0.0.101","192.168.0.3","RSL","1514","5000,35644","1448","ip.access HANDOover CANDidate ENQuiry "
"15","3.499674","10.0.0.101","192.168.0.3","TCP","1514","5000,35644","1448","5000  >  35644 [PSH, ACK] Seq=4085 Ack=1073 Win=16088 Len=1448 TSval=1785879828 TSecr=1654347198"
"16","3.499682","10.0.0.101","192.168.0.3","TCP","1514","5000,35644","1448","5000  >  35644 [ACK] Seq=5533 Ack=1073 Win=16088 Len=1448 TSval=1785879828 TSecr=1654347198"
"17","3.499698","10.0.0.101","192.168.0.3","SCCP (Int. ITU)","1514","5000,35644","1448","Unknown: 147 "
"18","3.499713","10.0.0.101","192.168.0.3","RSL","1514","5000,35644","1448","unknown 82 "
"19","3.499760","192.168.0.3","10.0.0.101","TCP","66","35644,5000","0","35644  >  5000 [ACK] Seq=1073 Ack=5533 Win=28992 Len=0 TSval=1654347238 TSecr=1785879828"
"20","3.499776","192.168.0.3","10.0.0.101","TCP","66","35644,5000","0","35644  >  5000 [ACK] Seq=1073 Ack=8429 Win=28964 Len=0 TSval=1654347238 TSecr=1785879828"
"21","3.499786","192.168.0.3","10.0.0.101","TCP","66","35644,5000","0","35644  >  5000 [ACK] Seq=1073 Ack=9877 Win=28952 Len=0 TSval=1654347238 TSecr=1785879828"
"22","3.500160","192.168.0.3","10.0.0.101","RSL","602","35644,5000","536","CHANnel ReQuireD "
"23","3.509791","10.0.0.101","192.168.0.3","RSL","580","5000,35644","514","MultiRate CODEC MODification REQuest "
"24","3.509809","10.0.0.101","192.168.0.3","RSL","1514","5000,35644","1448","ip.access HANDOover CANDidate ENQuiry "
"25","3.509825","10.0.0.101","192.168.0.3","TCP","1514","5000,35644","1448","5000  >  35644 [PSH, ACK] Seq=11839 Ack=1073 Win=16088 Len=1448 TSval=1785879838 TSecr=1654347228"
"26","3.509844","10.0.0.101","192.168.0.3","TCP","1514","5000,35644","1448","5000  >  35644 [ACK] Seq=13287 Ack=1073 Win=16088 Len=1448 TSval=1785879838 TSecr=1654347228"
"27","3.509866","192.168.0.3","10.0.0.101","TCP","66","35644,5000","0","35644  >  5000 [ACK] Seq=1609 Ack=10391 Win=29014 Len=0 TSval=1654347248 TSecr=1785879835"
"28","3.509873","10.0.0.101","192.168.0.3","TCP","1514","5000,35644","1448","5000  >  35644 [PSH, ACK] Seq=14735 Ack=1073 Win=16088 Len=1448 TSval=1785879838 TSecr=1654347228"
"29","3.509882","192.168.0.3","10.0.0.101","TCP","66","35644,5000","0","35644  >  5000 [ACK] Seq=1609 Ack=11839 Win=28992 Len=0 TSval=1654347248 TSecr=1785879838"
"30","3.509921","192.168.0.3","10.0.0.101","TCP","66","35644,5000","0","35644  >  5000 [ACK] Seq=1609 Ack=13287 Win=28980 Len=0 TSval=1654347248 TSecr=1785879838"
"31","3.509937","192.168.0.3","10.0.0.101","TCP","66","35644,5000","0","35644  >  5000 [ACK] Seq=1609 Ack=14735 Win=28968 Len=0 TSval=1654347248 TSecr=1785879838"
"32","3.509944","192.168.0.3","10.0.0.101","TCP","66","35644,5000","0","35644  >  5000 [ACK] Seq=1609 Ack=16183 Win=28956 Len=0 TSval=1654347248 TSecr=1785879838"
"33","3.519963","10.0.0.101","192.168.0.3","TCP","66","5000,35644","0","5000  >  35644 [ACK] Seq=16183 Ack=1609 Win=16088 Len=0 TSval=1785879845 TSecr=1654347238"
"34","3.519983","10.0.0.101","192.168.0.3","TCP","1514","5000,35644","1448","5000  >  35644 [ACK] Seq=16183 Ack=1609 Win=16088 Len=1448 TSval=1785879851 TSecr=1654347238"
"35","3.520004","10.0.0.101","192.168.0.3","RSL","1514","5000,35644","1448","unknown 0 "
"36","3.520025","10.0.0.101","192.168.0.3","TCP","1514","5000,35644","1448","5000  >  35644 [ACK] Seq=19079 Ack=1609 Win=16088 Len=1448 TSval=1785879851 TSecr=1654347238"
"37","3.520044","10.0.0.101","192.168.0.3","TCP","1514","5000,35644","1448","5000  >  35644 [ACK] Seq=20527 Ack=1609 Win=16088 Len=1448 TSval=1785879851 TSecr=1654347238"
"38","3.520067","192.168.0.3","10.0.0.101","TCP","66","35644,5000","0","35644  >  5000 [ACK] Seq=1609 Ack=17631 Win=29004 Len=0 TSval=1654347258 TSecr=1785879851"
"39","3.520074","10.0.0.101","192.168.0.3","TCP","1514","5000,35644","1448","5000  >  35644 [PSH, ACK] Seq=21975 Ack=1609 Win=16088 Len=1448 TSval=1785879851 TSecr=1654347238"
"40","3.520080","192.168.0.3","10.0.0.101","TCP","66","35644,5000","0","35644  >  5000 [ACK] Seq=1609 Ack=19079 Win=28992 Len=0 TSval=1654347258 TSecr=1785879851"
"41","3.520104","192.168.0.3","10.0.0.101","TCP","66","35644,5000","0","35644  >  5000 [ACK] Seq=1609 Ack=20527 Win=28980 Len=0 TSval=1654347258 TSecr=1785879851"
"42","3.520112","192.168.0.3","10.0.0.101","TCP","66","35644,5000","0","35644  >  5000 [ACK] Seq=1609 Ack=21975 Win=28968 Len=0 TSval=1654347258 TSecr=1785879851"
"43","3.530168","10.0.0.101","192.168.0.3","TCP","1000","5000,35644","934","5000  >  35644 [PSH, ACK] Seq=23423 Ack=1609 Win=16088 Len=934 TSval=1785879855 TSecr=1654347248"
"44","3.530188","10.0.0.101","192.168.0.3","RSL Cell Broadcast","1514","5000,35644","1448","SMS BroadCast CoMmanD  (CBS Page)"
"45","3.530196","10.0.0.101","192.168.0.3","TCP","1514","5000,35644","1448","5000  >  35644 [PSH, ACK] Seq=25805 Ack=1609 Win=16088 Len=1448 TSval=1785879860 TSecr=1654347248"
"46","3.530259","192.168.0.3","10.0.0.101","TCP","66","35644,5000","0","35644  >  5000 [ACK] Seq=1609 Ack=24357 Win=29004 Len=0 TSval=1654347268 TSecr=1785879851"
"47","3.530300","192.168.0.3","10.0.0.101","TCP","66","35644,5000","0","35644  >  5000 [ACK] Seq=1609 Ack=27253 Win=28980 Len=0 TSval=1654347268 TSecr=1785879860"
"48","3.540288","10.0.0.101","192.168.0.3","TCP","1514","5000,35644","1448","5000  >  35644 [ACK] Seq=27253 Ack=1609 Win=16088 Len=1448 TSval=1785879870 TSecr=1654347258"
"49","3.540313","10.0.0.101","192.168.0.3","TCP","1514","5000,35644","1448","5000  >  35644 [PSH, ACK] Seq=28701 Ack=1609 Win=16088 Len=1448 TSval=1785879870 TSecr=1654347258"
"50","3.540398","10.0.0.101","192.168.0.3","TCP","1514","5000,35644","1448","5000  >  35644 [ACK] Seq=30149 Ack=1609 Win=16088 Len=1448 TSval=1785879870 TSecr=1654347258"
"51","3.540440","10.0.0.101","192.168.0.3","TCP","1514","5000,35644","1448","5000  >  35644 [PSH, ACK] Seq=31597 Ack=1609 Win=16088 Len=1448 TSval=1785879870 TSecr=1654347258"
"52","3.540448","10.0.0.101","192.168.0.3","TCP","1514","5000,35644","1448","5000  >  35644 [ACK] Seq=33045 Ack=1609 Win=16088 Len=1448 TSval=1785879870 TSecr=1654347258"
"53","3.540456","10.0.0.101","192.168.0.3","TCP","1514","5000,35644","1448","5000  >  35644 [ACK] Seq=34493 Ack=1609 Win=16088 Len=1448 TSval=1785879870 TSecr=1654347258"
"54","3.540466","10.0.0.101","192.168.0.3","TCP","1514","5000,35644","1448","5000  >  35644 [PSH, ACK] Seq=35941 Ack=1609 Win=16088 Len=1448 TSval=1785879870 TSecr=1654347258"
"55","3.540474","10.0.0.101","192.168.0.3","TCP","1514","5000,35644","1448","5000  >  35644 [ACK] Seq=37389 Ack=1609 Win=16088 Len=1448 TSval=1785879870 TSecr=1654347258"
"56","3.540413","192.168.0.3","10.0.0.101","TCP","66","35644,5000","0","35644  >  5000 [ACK] Seq=1609 Ack=30149 Win=28992 Len=0 TSval=1654347278 TSecr=1785879870"
"57","3.540520","10.0.0.101","192.168.0.3","TCP","1514","5000,35644","1448","5000  >  35644 [ACK] Seq=38837 Ack=1609 Win=16088 Len=1448 TSval=1785879870 TSecr=1654347258"
"58","3.540543","10.0.0.101","192.168.0.3","TCP","1514","5000,35644","1448","5000  >  35644 [PSH, ACK] Seq=40285 Ack=1609 Win=16088 Len=1448 TSval=1785879870 TSecr=1654347258"
"59","3.540551","10.0.0.101","192.168.0.3","TCP","1514","5000,35644","1448","5000  >  35644 [ACK] Seq=41733 Ack=1609 Win=16088 Len=1448 TSval=1785879870 TSecr=1654347258"
"60","3.540598","10.0.0.101","192.168.0.3","TCP","1514","5000,35644","1448","5000  >  35644 [ACK] Seq=43181 Ack=1609 Win=16088 Len=1448 TSval=1785879870 TSecr=1654347258"
"61","3.540605","192.168.0.3","10.0.0.101","TCP","66","35644,5000","0","35644  >  5000 [ACK] Seq=1609 Ack=33045 Win=28992 Len=0 TSval=1654347279 TSecr=1785879870"
"62","3.540610","10.0.0.101","192.168.0.3","TCP","1514","5000,35644","1448","5000  >  35644 [PSH, ACK] Seq=44629 Ack=1609 Win=16088 Len=1448 TSval=1785879870 TSecr=1654347258"
"63","3.540629","10.0.0.101","192.168.0.3","TCP","1514","5000,35644","1448","5000  >  35644 [ACK] Seq=46077 Ack=1609 Win=16088 Len=1448 TSval=1785879870 TSecr=1654347258"
"64","3.540889","192.168.0.3","10.0.0.101","RSL","602","35644,5000","536","CHANnel ReQuireD "
"65","3.550645","10.0.0.101","192.168.0.3","TCP","182","5000,35644","116","5000  >  35644 [PSH, ACK] Seq=47525 Ack=1609 Win=16088 Len=116 TSval=1785879876 TSecr=1654347268"
"66","3.550662","10.0.0.101","192.168.0.3","RSL","1514","5000,35644","1448","ip.access HANDOover CANDidate ENQuiry "
"67","3.550686","10.0.0.101","192.168.0.3","TCP","1514","5000,35644","1448","5000  >  35644 [PSH, ACK] Seq=49089 Ack=1609 Win=16088 Len=1448 TSval=1785879882 TSecr=1654347268"
"68","3.550729","192.168.0.3","10.0.0.101","TCP","66","35644,5000","0","35644  >  5000 [ACK] Seq=2145 Ack=49089 Win=28992 Len=0 TSval=1654347289 TSecr=1785879876"
"69","3.550735","10.0.0.101","192.168.0.3","RSL","1514","5000,35644","1448","ip.access DLCX INDication "
"70","3.550755","10.0.0.101","192.168.0.3","TCP","1514","5000,35644","1448","5000  >  35644 [PSH, ACK] Seq=51985 Ack=1609 Win=16088 Len=1448 TSval=1785879882 TSecr=1654347268"
"71","3.550786","10.0.0.101","192.168.0.3","TCP","1514","5000,35644","1448","5000  >  35644 [ACK] Seq=53433 Ack=1609 Win=16088 Len=1448 TSval=1785879882 TSecr=1654347268"
"72","3.550802","10.0.0.101","192.168.0.3","TCP","1514","5000,35644","1448","5000  >  35644 [ACK] Seq=54881 Ack=1609 Win=16088 Len=1448 TSval=1785879882 TSecr=1654347268"
"73","3.550822","192.168.0.3","10.0.0.101","TCP","66","35644,5000","0","35644  >  5000 [ACK] Seq=2145 Ack=53433 Win=28956 Len=0 TSval=1654347289 TSecr=1785879882"
"74","3.550841","10.0.0.101","192.168.0.3","TCP","1514","5000,35644","1448","5000  >  35644 [PSH, ACK] Seq=56329 Ack=1609 Win=16088 Len=1448 TSval=1785879882 TSecr=1654347268"
"75","3.550866","10.0.0.101","192.168.0.3","TCP","1514","5000,35644","1448","5000  >  35644 [ACK] Seq=57777 Ack=1609 Win=16088 Len=1448 TSval=1785879882 TSecr=1654347268"
"76","3.550885","192.168.0.3","10.0.0.101","TCP","66","35644,5000","0","35644  >  5000 [ACK] Seq=2145 Ack=56329 Win=28932 Len=0 TSval=1654347289 TSecr=1785879882"
"77","3.550945","192.168.0.3","10.0.0.101","TCP","66","35644,5000","0","35644  >  5000 [ACK] Seq=2145 Ack=59225 Win=28908 Len=0 TSval=1654347289 TSecr=1785879882"
"78","3.560973","10.0.0.101","192.168.0.3","RSL","1514","5000,35644","1448","DATA REQuest (DTAP) (TP) "
"79","3.560991","10.0.0.101","192.168.0.3","RSL","1514","5000,35644","1448","ip.access MDCX ACK "
"80","3.561007","10.0.0.101","192.168.0.3","TCP","1514","5000,35644","1448","5000  >  35644 [PSH, ACK] Seq=62121 Ack=1609 Win=16088 Len=1448 TSval=1785879886 TSecr=1654347278"
"81","3.561017","10.0.0.101","192.168.0.3","RSL","1514","5000,35644","1448","NOTification CoMmanD "
"82","3.561034","10.0.0.101","192.168.0.3","RSL","1514","5000,35644","1448","unknown 16 "
"83","3.561065","192.168.0.3","10.0.0.101","TCP","66","35644,5000","0","35644  >  5000 [ACK] Seq=2145 Ack=63569 Win=28980 Len=0 TSval=1654347299 TSecr=1785879886"
"84","3.561094","10.0.0.101","192.168.0.3","RSL","1514","5000,35644","1448","unknown 32 "
"85","3.561132","10.0.0.101","192.168.0.3","TCP","1514","5000,35644","1448","5000  >  35644 [PSH, ACK] Seq=67913 Ack=2145 Win=16088 Len=1448 TSval=1785879886 TSecr=1654347279"
"86","3.561132","192.168.0.3","10.0.0.101","TCP","66","35644,5000","0","35644  >  5000 [ACK] Seq=2145 Ack=66465 Win=28952 Len=0 TSval=1654347299 TSecr=1785879886"
"87","3.561169","192.168.0.3","10.0.0.101","RSL","602","35644,5000","536","CHANnel ReQuireD "
"88","3.561151","10.0.0.101","192.168.0.3","TCP","1514","5000,35644","1448","5000  >  35644 [ACK] Seq=69361 Ack=2145 Win=16088 Len=1448 TSval=1785879886 TSecr=1654347279"
"89","3.561204","10.0.0.101","192.168.0.3","TCP","1514","5000,35644","1448","5000  >  35644 [PSH, ACK] Seq=70809 Ack=2145 Win=16088 Len=1448 TSval=1785879886 TSecr=1654347279"
"90","3.561218","10.0.0.101","192.168.0.3","TCP","1514","5000,35644","1448","5000  >  35644 [ACK] Seq=72257 Ack=2145 Win=16088 Len=1448 TSval=1785879886 TSecr=1654347279"
"91","3.561226","10.0.0.101","192.168.0.3","TCP","1514","5000,35644","1448","5000  >  35644 [PSH, ACK] Seq=73705 Ack=2145 Win=16088 Len=1448 TSval=1785879886 TSecr=1654347279"
"92","3.561233","10.0.0.101","192.168.0.3","TCP","1514","5000,35644","1448","5000  >  35644 [ACK] Seq=75153 Ack=2145 Win=16088 Len=1448 TSval=1785879886 TSecr=1654347279"
"93","3.561260","10.0.0.101","192.168.0.3","TCP","1514","5000,35644","1448","5000  >  35644 [PSH, ACK] Seq=76601 Ack=2145 Win=16088 Len=1448 TSval=1785879886 TSecr=1654347279"
"94","3.561271","10.0.0.101","192.168.0.3","TCP","1514","5000,35644","1448","5000  >  35644 [ACK] Seq=78049 Ack=2145 Win=16088 Len=1448 TSval=1785879886 TSecr=1654347279"
"95","3.561295","192.168.0.3","10.0.0.101","TCP","66","35644,5000","0","35644  >  5000 [ACK] Seq=2681 Ack=76601 Win=28868 Len=0 TSval=1654347299 TSecr=1785879886"
"96","3.561304","10.0.0.101","192.168.0.3","TCP","1514","5000,35644","1448","5000  >  35644 [PSH, ACK] Seq=79497 Ack=2145 Win=16088 Len=1448 TSval=1785879886 TSecr=1654347279"
"97","3.561323","10.0.0.101","192.168.0.3","TCP","1514","5000,35644","1448","5000  >  35644 [ACK] Seq=80945 Ack=2145 Win=16088 Len=1448 TSval=1785879886 TSecr=1654347279"
"98","3.561352","192.168.0.3","10.0.0.101","TCP","66","35644,5000","0","35644  >  5000 [ACK] Seq=2681 Ack=79497 Win=28844 Len=0 TSval=1654347299 TSecr=1785879886"
"99","3.562261","192.168.0.3","10.0.0.101","TCP","66","35644,5000","0","35644  >  5000 [ACK] Seq=2681 Ack=82393 Win=28820 Len=0 TSval=1654347300 TSecr=1785879886"
"100","3.571423","10.0.0.101","192.168.0.3","TCP","1514","5000,35644","1448","5000  >  35644 [PSH, ACK] Seq=82393 Ack=2145 Win=16088 Len=1448 TSval=1785879886 TSecr=1654347279"
"101","3.571445","10.0.0.101","192.168.0.3","RSL","1514","5000,35644","1448","unknown 78 "
"102","3.571466","10.0.0.101","192.168.0.3","TCP","1514","5000,35644","1448","5000  >  35644 [PSH, ACK] Seq=85289 Ack=2145 Win=16088 Len=1448 TSval=1785879886 TSecr=1654347279"
"103","3.571507","10.0.0.101","192.168.0.3","TCP","1514","5000,35644","1448","5000  >  35644 [ACK] Seq=86737 Ack=2145 Win=16088 Len=1448 TSval=1785879886 TSecr=1654347279"
"104","3.571526","192.168.0.3","10.0.0.101","TCP","66","35644,5000","0","35644  >  5000 [ACK] Seq=2681 Ack=85289 Win=28992 Len=0 TSval=1654347310 TSecr=1785879886"
"105","3.571558","10.0.0.101","192.168.0.3","TCP","1514","5000,35644","1448","5000  >  35644 [PSH, ACK] Seq=88185 Ack=2145 Win=16088 Len=1448 TSval=1785879886 TSecr=1654347279"
"106","3.571565","192.168.0.3","10.0.0.101","TCP","66","35644,5000","0","35644  >  5000 [ACK] Seq=2681 Ack=88185 Win=28968 Len=0 TSval=1654347310 TSecr=1785879886"
"107","3.571585","10.0.0.101","192.168.0.3","IPA","1514","5000,35644","1448","OSMO EXT unknown 0x51 "
"108","3.571602","10.0.0.101","192.168.0.3","TCP","1514","5000,35644","1448","5000  >  35644 [PSH, ACK] Seq=91081 Ack=2145 Win=16088 Len=1448 TSval=1785879886 TSecr=1654347279"
"109","3.571639","10.0.0.101","192.168.0.3","TCP","1514","5000,35644","1448","5000  >  35644 [ACK] Seq=92529 Ack=2145 Win=16088 Len=1448 TSval=1785879893 TSecr=1654347279"
"110","3.571649","10.0.0.101","192.168.0.3","RSL","1514","5000,35644","1448","ip.access MDCX ACK "
"111","3.571659","10.0.0.101","192.168.0.3","TCP","1514","5000,35644","1448","5000  >  35644 [ACK] Seq=95425 Ack=2145 Win=16088 Len=1448 TSval=1785879893 TSecr=1654347279"
"112","3.571665","192.168.0.3","10.0.0.101","TCP","66","35644,5000","0","35644  >  5000 [ACK] Seq=2681 Ack=92529 Win=28932 Len=0 TSval=1654347310 TSecr=1785879886"
"113","3.571688","10.0.0.101","192.168.0.3","TCP","1514","5000,35644","1448","5000  >  35644 [ACK] Seq=96873 Ack=2145 Win=16088 Len=1448 TSval=1785879893 TSecr=1654347279"
"114","3.571711","10.0.0.101","192.168.0.3","TCP","1514","5000,35644","1448","5000  >  35644 [PSH, ACK] Seq=98321 Ack=2145 Win=16088 Len=1448 TSval=1785879893 TSecr=1654347279"
"115","3.571747","10.0.0.101","192.168.0.3","TCP","1514","5000,35644","1448","5000  >  35644 [ACK] Seq=99769 Ack=2145 Win=16088 Len=1448 TSval=1785879897 TSecr=1654347289"
"116","3.571748","192.168.0.3","10.0.0.101","TCP","66","35644,5000","0","35644  >  5000 [ACK] Seq=2681 Ack=96873 Win=28892 Len=0 TSval=1654347310 TSecr=1785879893"
"117","3.571775","10.0.0.101","192.168.0.3","IPA","1514","5000,35644","1448","IPA unknown 0xb3 "
"118","3.571815","192.168.0.3","10.0.0.101","TCP","66","35644,5000","0","35644  >  5000 [ACK] Seq=2681 Ack=99769 Win=28992 Len=0 TSval=1654347310 TSecr=1785879893"
"119","3.571844","10.0.0.101","192.168.0.3","TCP","1514","5000,35644","1448","5000  >  35644 [ACK] Seq=102665 Ack=2145 Win=16088 Len=1448 TSval=1785879897 TSecr=1654347289"
"120","3.571858","10.0.0.101","192.168.0.3","TCP","1514","5000,35644","1448","5000  >  35644 [PSH, ACK] Seq=104113 Ack=2145 Win=16088 Len=1448 TSval=1785879897 TSecr=1654347289"
"121","3.572325","192.168.0.3","10.0.0.101","TCP","66","35644,5000","0","35644  >  5000 [ACK] Seq=2681 Ack=105561 Win=28944 Len=0 TSval=1654347310 TSecr=1785879897"
"122","3.574131","192.168.0.3","10.0.0.101","RSL","1514","35644,5000","1448","CHANnel ReQuireD "
"123","3.581955","10.0.0.101","192.168.0.3","TCP","1514","5000,35644","1448","5000  >  35644 [ACK] Seq=105561 Ack=2145 Win=16088 Len=1448 TSval=1785879897 TSecr=1654347289"
"124","3.581971","10.0.0.101","192.168.0.3","TCP","1514","5000,35644","1448","5000  >  35644 [PSH, ACK] Seq=107009 Ack=2145 Win=16088 Len=1448 TSval=1785879897 TSecr=1654347289"
"125","3.581995","10.0.0.101","192.168.0.3","TCP","1514","5000,35644","1448","5000  >  35644 [ACK] Seq=108457 Ack=2145 Win=16088 Len=1448 TSval=1785879897 TSecr=1654347289"
"126","3.582032","10.0.0.101","192.168.0.3","TCP","1514","5000,35644","1448","5000  >  35644 [ACK] Seq=109905 Ack=2145 Win=16088 Len=1448 TSval=1785879897 TSecr=1654347289"
"127","3.582058","10.0.0.101","192.168.0.3","TCP","1514","5000,35644","1448","5000  >  35644 [PSH, ACK] Seq=111353 Ack=2145 Win=16088 Len=1448 TSval=1785879897 TSecr=1654347289"
"128","3.582076","192.168.0.3","10.0.0.101","TCP","66","35644,5000","0","35644  >  5000 [ACK] Seq=4129 Ack=109905 Win=28980 Len=0 TSval=1654347320 TSecr=1785879897"
"129","3.582082","10.0.0.101","192.168.0.3","TCP","1514","5000,35644","1448","5000  >  35644 [ACK] Seq=112801 Ack=2145 Win=16088 Len=1448 TSval=1785879897 TSecr=1654347289"
"130","3.582123","10.0.0.101","192.168.0.3","TCP","1514","5000,35644","1448","5000  >  35644 [ACK] Seq=114249 Ack=2145 Win=16088 Len=1448 TSval=1785879897 TSecr=1654347289"
"131","3.582128","192.168.0.3","10.0.0.101","TCP","66","35644,5000","0","35644  >  5000 [ACK] Seq=4129 Ack=112801 Win=28956 Len=0 TSval=1654347320 TSecr=1785879897"
"132","3.582136","10.0.0.101","192.168.0.3","TCP","1514","5000,35644","1448","5000  >  35644 [PSH, ACK] Seq=115697 Ack=2145 Win=16088 Len=1448 TSval=1785879897 TSecr=1654347289"
"133","3.582180","10.0.0.101","192.168.0.3","TCP","1514","5000,35644","1448","5000  >  35644 [ACK] Seq=117145 Ack=2145 Win=16088 Len=1448 TSval=1785879897 TSecr=1654347289"
"134","3.582204","192.168.0.3","10.0.0.101","TCP","66","35644,5000","0","35644  >  5000 [ACK] Seq=4129 Ack=115697 Win=29004 Len=0 TSval=1654347320 TSecr=1785879897"
"135","3.582248","10.0.0.101","192.168.0.3","TCP","1514","5000,35644","1448","5000  >  35644 [ACK] Seq=118593 Ack=2145 Win=16088 Len=1448 TSval=1785879897 TSecr=1654347289"
"136","3.582279","10.0.0.101","192.168.0.3","TCP","1514","5000,35644","1448","5000  >  35644 [PSH, ACK] Seq=120041 Ack=2145 Win=16088 Len=1448 TSval=1785879897 TSecr=1654347289"
"137","3.582290","10.0.0.101","192.168.0.3","TCP","204","5000,35644","138","5000  >  35644 [PSH, ACK] Seq=121489 Ack=2145 Win=16088 Len=138 TSval=1785879897 TSecr=1654347289"
"138","3.582298","10.0.0.101","192.168.0.3","RSL","1514","5000,35644","1448","ip.access HANDOover CANDidate ENQuiry "
"139","3.582306","10.0.0.101","192.168.0.3","TCP","1514","5000,35644","1448","5000  >  35644 [PSH, ACK] Seq=123075 Ack=2145 Win=16088 Len=1448 TSval=1785879906 TSecr=1654347289"
"140","3.582319","10.0.0.101","192.168.0.3","TCP","1514","5000,35644","1448","5000  >  35644 [ACK] Seq=124523 Ack=2145 Win=16088 Len=1448 TSval=1785879907 TSecr=1654347299"
"141","3.582326","10.0.0.101","192.168.0.3","TCP","1514","5000,35644","1448","5000  >  35644 [ACK] Seq=125971 Ack=2145 Win=16088 Len=1448 TSval=1785879907 TSecr=1654347299"
"142","3.582703","192.168.0.3","10.0.0.101","TCP","66","35644,5000","0","35644  >  5000 [ACK] Seq=4129 Ack=127419 Win=28892 Len=0 TSval=1654347321 TSecr=1785879897"
"143","3.592462","10.0.0.101","192.168.0.3","TCP","1514","5000,35644","1448","5000  >  35644 [PSH, ACK] Seq=127419 Ack=2145 Win=16088 Len=1448 TSval=1785879907 TSecr=1654347299"
"144","3.592481","10.0.0.101","192.168.0.3","TCP","1514","5000,35644","1448","5000  >  35644 [ACK] Seq=128867 Ack=2145 Win=16088 Len=1448 TSval=1785879907 TSecr=1654347299"
"145","3.592494","10.0.0.101","192.168.0.3","RSL","1514","5000,35644","1448","unknown 32 "
"146","3.592516","10.0.0.101","192.168.0.3","TCP","1514","5000,35644","1448","5000  >  35644 [PSH, ACK] Seq=131763 Ack=2145 Win=16088 Len=1448 TSval=1785879907 TSecr=1654347299"
"147","3.592557","192.168.0.3","10.0.0.101","TCP","66","35644,5000","0","35644  >  5000 [ACK] Seq=4129 Ack=130315 Win=28992 Len=0 TSval=1654347331 TSecr=1785879907"
"148","3.592558","10.0.0.101","192.168.0.3","TCP","1514","5000,35644","1448","5000  >  35644 [ACK] Seq=133211 Ack=2681 Win=16088 Len=1448 TSval=1785879907 TSecr=1654347299"
"149","3.592592","192.168.0.3","10.0.0.101","TCP","66","35644,5000","0","35644  >  5000 [ACK] Seq=4129 Ack=133211 Win=28968 Len=0 TSval=1654347331 TSecr=1785879907"
"150","3.592593","10.0.0.101","192.168.0.3","TCP","1514","5000,35644","1448","5000  >  35644 [ACK] Seq=134659 Ack=2681 Win=16088 Len=1448 TSval=1785879907 TSecr=1654347299"
"151","3.592619","10.0.0.101","192.168.0.3","TCP","1514","5000,35644","1448","5000  >  35644 [PSH, ACK] Seq=136107 Ack=2681 Win=16088 Len=1448 TSval=1785879907 TSecr=1654347299"
"152","3.592655","10.0.0.101","192.168.0.3","TCP","1514","5000,35644","1448","5000  >  35644 [ACK] Seq=137555 Ack=2681 Win=16088 Len=1448 TSval=1785879907 TSecr=1654347299"
"153","3.592668","10.0.0.101","192.168.0.3","TCP","1514","5000,35644","1448","5000  >  35644 [ACK] Seq=139003 Ack=2681 Win=16088 Len=1448 TSval=1785879907 TSecr=1654347299"
"154","3.592682","10.0.0.101","192.168.0.3","RSL","1514","5000,35644","1448","BS POWER CONTROL "
"155","3.592692","10.0.0.101","192.168.0.3","TCP","1514","5000,35644","1448","5000  >  35644 [ACK] Seq=141899 Ack=2681 Win=16088 Len=1448 TSval=1785879907 TSecr=1654347299"
"156","3.592656","192.168.0.3","10.0.0.101","TCP","740","35644,5000","674","35644  >  5000 [PSH, ACK] Seq=4129 Ack=134659 Win=29004 Len=674 TSval=1654347331 TSecr=1785879907"
"157","3.592742","10.0.0.101","192.168.0.3","TCP","1514","5000,35644","1448","5000  >  35644 [ACK] Seq=143347 Ack=2681 Win=16088 Len=1448 TSval=1785879907 TSecr=1654347299"
"158","3.592754","10.0.0.101","192.168.0.3","TCP","1514","5000,35644","1448","5000  >  35644 [PSH, ACK] Seq=144795 Ack=2681 Win=16088 Len=1448 TSval=1785879907 TSecr=1654347299"
"159","3.592771","10.0.0.101","192.168.0.3","TCP","1514","5000,35644","1448","5000  >  35644 [ACK] Seq=146243 Ack=2681 Win=16088 Len=1448 TSval=1785879916 TSecr=1654347300"
"160","3.592781","10.0.0.101","192.168.0.3","TCP","1514","5000,35644","1448","5000  >  35644 [PSH, ACK] Seq=147691 Ack=2681 Win=16088 Len=1448 TSval=1785879916 TSecr=1654347300"
"161","3.592808","10.0.0.101","192.168.0.3","TCP","1514","5000,35644","1448","5000  >  35644 [ACK] Seq=149139 Ack=2681 Win=16088 Len=1448 TSval=1785879916 TSecr=1654347300"
"162","3.592962","192.168.0.3","10.0.0.101","TCP","66","35644,5000","0","35644  >  5000 [ACK] Seq=4803 Ack=150587 Win=28872 Len=0 TSval=1654347331 TSecr=1785879907"
"163","3.602901","10.0.0.101","192.168.0.3","RSL","1514","5000,35644","1448","PRE-HANDOver NOTIFication "
"164","3.602917","10.0.0.101","192.168.0.3","TCP","1514","5000,35644","1448","5000  >  35644 [PSH, ACK] Seq=152035 Ack=2681 Win=16088 Len=1448 TSval=1785879916 TSecr=1654347300"
"165","3.602946","10.0.0.101","192.168.0.3","IPA","1514","5000,35644","1448","IPA unknown 0x3b "
"166","3.602969","10.0.0.101","192.168.0.3","TCP","1514","5000,35644","1448","5000  >  35644 [ACK] Seq=154931 Ack=2681 Win=16088 Len=1448 TSval=1785879916 TSecr=1654347300"
"167","3.602988","192.168.0.3","10.0.0.101","TCP","66","35644,5000","0","35644  >  5000 [ACK] Seq=4803 Ack=153483 Win=28992 Len=0 TSval=1654347341 TSecr=1785879916"
"168","3.603006","10.0.0.101","192.168.0.3","TCP","1514","5000,35644","1448","5000  >  35644 [PSH, ACK] Seq=156379 Ack=2681 Win=16088 Len=1448 TSval=1785879916 TSecr=1654347300"
"169","3.603036","192.168.0.3","10.0.0.101","TCP","66","35644,5000","0","35644  >  5000 [ACK] Seq=4803 Ack=156379 Win=28964 Len=0 TSval=1654347341 TSecr=1785879916"
"170","3.603059","10.0.0.101","192.168.0.3","TCP","1514","5000,35644","1448","5000  >  35644 [ACK] Seq=157827 Ack=2681 Win=16088 Len=1448 TSval=1785879916 TSecr=1654347300"
"171","3.603071","10.0.0.101","192.168.0.3","RSL","1514","5000,35644","1448","unknown 104 "
"172","3.603080","10.0.0.101","192.168.0.3","TCP","1514","5000,35644","1448","5000  >  35644 [PSH, ACK] Seq=160723 Ack=2681 Win=16088 Len=1448 TSval=1785879916 TSecr=1654347300"
"173","3.603122","192.168.0.3","10.0.0.101","TCP","66","35644,5000","0","35644  >  5000 [ACK] Seq=4803 Ack=159275 Win=29004 Len=0 TSval=1654347341 TSecr=1785879916"
"174","3.603123","10.0.0.101","192.168.0.3","TCP","1514","5000,35644","1448","5000  >  35644 [ACK] Seq=162171 Ack=2681 Win=16088 Len=1448 TSval=1785879918 TSecr=1654347310"
"175","3.603155","10.0.0.101","192.168.0.3","TCP","1514","5000,35644","1448","5000  >  35644 [ACK] Seq=163619 Ack=2681 Win=16088 Len=1448 TSval=1785879918 TSecr=1654347310"
"176","3.603164","10.0.0.101","192.168.0.3","TCP","1514","5000,35644","1448","5000  >  35644 [PSH, ACK] Seq=165067 Ack=2681 Win=16088 Len=1448 TSval=1785879918 TSecr=1654347310"
"177","3.603185","10.0.0.101","192.168.0.3","TCP","1514","5000,35644","1448","5000  >  35644 [ACK] Seq=166515 Ack=2681 Win=16088 Len=1448 TSval=1785879918 TSecr=1654347310"
"178","3.603192","10.0.0.101","192.168.0.3","TCP","1514","5000,35644","1448","5000  >  35644 [PSH, ACK] Seq=167963 Ack=2681 Win=16088 Len=1448 TSval=1785879918 TSecr=1654347310"
"179","3.603234","10.0.0.101","192.168.0.3","TCP","1442","5000,35644","1376","5000  >  35644 [PSH, ACK] Seq=169411 Ack=4129 Win=16088 Len=1376 TSval=1785879928 TSecr=1654347312"
"180","3.603275","10.0.0.101","192.168.0.3","RSL","1514","5000,35644","1448","ip.access HANDOover CANDidate ENQuiry "
"181","3.603295","10.0.0.101","192.168.0.3","TCP","1514","5000,35644","1448","5000  >  35644 [PSH, ACK] Seq=172235 Ack=4129 Win=16088 Len=1448 TSval=1785879930 TSecr=1654347312"
"182","3.603447","192.168.0.3","10.0.0.101","TCP","66","35644,5000","0","35644  >  5000 [ACK] Seq=4803 Ack=173683 Win=28884 Len=0 TSval=1654347341 TSecr=1785879916"
"183","3.610423","192.168.0.3","10.0.0.101","RSL","1514","35644,5000","1448","CHANnel ReQuireD "
"184","3.613348","10.0.0.101","192.168.0.3","IPA","1514","5000,35644","1448","HSL Debug [Malformed Packet: length of contained item exceeds length of containing item]"
"185","3.613363","10.0.0.101","192.168.0.3","TCP","1514","5000,35644","1448","5000  >  35644 [PSH, ACK] Seq=175131 Ack=4129 Win=16088 Len=1448 TSval=1785879930 TSecr=1654347312"
"186","3.613390","10.0.0.101","192.168.0.3","TCP","1514","5000,35644","1448","5000  >  35644 [ACK] Seq=176579 Ack=4129 Win=16088 Len=1448 TSval=1785879930 TSecr=1654347312"
"187","3.613434","10.0.0.101","192.168.0.3","TCP","1514","5000,35644","1448","5000  >  35644 [ACK] Seq=178027 Ack=4129 Win=16088 Len=1448 TSval=1785879930 TSecr=1654347312"
"188","3.613451","10.0.0.101","192.168.0.3","TCP","1514","5000,35644","1448","5000  >  35644 [PSH, ACK] Seq=179475 Ack=4129 Win=16088 Len=1448 TSval=1785879930 TSecr=1654347312"
"189","3.613479","192.168.0.3","10.0.0.101","TCP","66","35644,5000","0","35644  >  5000 [ACK] Seq=6251 Ack=178027 Win=28980 Len=0 TSval=1654347351 TSecr=1785879930"
"190","3.613539","10.0.0.101","192.168.0.3","TCP","1514","5000,35644","1448","5000  >  35644 [ACK] Seq=180923 Ack=4129 Win=16088 Len=1448 TSval=1785879930 TSecr=1654347312"
"191","3.613551","10.0.0.101","192.168.0.3","TCP","1514","5000,35644","1448","5000  >  35644 [ACK] Seq=182371 Ack=4129 Win=16088 Len=1448 TSval=1785879930 TSecr=1654347312"
"192","3.613564","10.0.0.101","192.168.0.3","TCP","1514","5000,35644","1448","5000  >  35644 [PSH, ACK] Seq=183819 Ack=4129 Win=16088 Len=1448 TSval=1785879930 TSecr=1654347312"
"193","3.613542","192.168.0.3","10.0.0.101","TCP","66","35644,5000","0","35644  >  5000 [ACK] Seq=6251 Ack=180923 Win=28956 Len=0 TSval=1654347352 TSecr=1785879930"
"194","3.613600","10.0.0.101","192.168.0.3","TCP","1514","5000,35644","1448","5000  >  35644 [ACK] Seq=185267 Ack=4129 Win=16088 Len=1448 TSval=1785879930 TSecr=1654347312"
"195","3.613657","10.0.0.101","192.168.0.3","RSL","1514","5000,35644","1448","LISTENER DETection "
"196","3.613672","10.0.0.101","192.168.0.3","TCP","1514","5000,35644","1448","5000  >  35644 [PSH, ACK] Seq=188163 Ack=4129 Win=16088 Len=1448 TSval=1785879930 TSecr=1654347312"
"197","3.613680","10.0.0.101","192.168.0.3","TCP","1514","5000,35644","1448","5000  >  35644 [ACK] Seq=189611 Ack=4129 Win=16088 Len=1448 TSval=1785879930 TSecr=1654347312"
"198","3.613691","10.0.0.101","192.168.0.3","TCP","1514","5000,35644","1448","5000  >  35644 [ACK] Seq=191059 Ack=4129 Win=16088 Len=1448 TSval=1785879931 TSecr=1654347312"
"199","3.613698","10.0.0.101","192.168.0.3","RSL","1514","5000,35644","1448","unknown 110 "
"200","3.613705","10.0.0.101","192.168.0.3","TCP","1514","5000,35644","1448","5000  >  35644 [ACK] Seq=193955 Ack=4129 Win=16088 Len=1448 TSval=1785879931 TSecr=1654347312"
"201","3.613715","10.0.0.101","192.168.0.3","TCP","1514","5000,35644","1448","5000  >  35644 [ACK] Seq=195403 Ack=4803 Win=16088 Len=1448 TSval=1785879942 TSecr=1654347331"
"202","3.613782","192.168.0.3","10.0.0.101","TCP","66","35644,5000","0","35644  >  5000 [ACK] Seq=6251 Ack=185267 Win=28976 Len=0 TSval=1654347352 TSecr=1785879930"
"203","3.613841","192.168.0.3","10.0.0.101","TCP","204","35644,5000","138","35644  >  5000 [PSH, ACK] Seq=6251 Ack=196851 Win=28880 Len=138 TSval=1654347352 TSecr=1785879930"
"204","3.623803","10.0.0.101","192.168.0.3","RSL","1514","5000,35644","1448","ip.access PDCH ACTIVATION ACK "
"205","3.623823","10.0.0.101","192.168.0.3","TCP","1514","5000,35644","1448","5000  >  35644 [ACK] Seq=198299 Ack=4803 Win=16088 Len=1448 TSval=1785879942 TSecr=1654347331"
"206","3.623850","10.0.0.101","192.168.0.3","TCP","1514","5000,35644","1448","5000  >  35644 [PSH, ACK] Seq=199747 Ack=4803 Win=16088 Len=1448 TSval=1785879942 TSecr=1654347331"
"207","3.623864","10.0.0.101","192.168.0.3","TCP","1514","5000,35644","1448","5000  >  35644 [ACK] Seq=201195 Ack=4803 Win=16088 Len=1448 TSval=1785879942 TSecr=1654347331"
"208","3.623893","10.0.0.101","192.168.0.3","TCP","1514","5000,35644","1448","5000  >  35644 [ACK] Seq=202643 Ack=4803 Win=16088 Len=1448 TSval=1785879942 TSecr=1654347331"
"209","3.623914","192.168.0.3","10.0.0.101","TCP","66","35644,5000","0","35644  >  5000 [ACK] Seq=6389 Ack=199747 Win=28992 Len=0 TSval=1654347362 TSecr=1785879942"
"210","3.623916","10.0.0.101","192.168.0.3","TCP","1514","5000,35644","1448","5000  >  35644 [PSH, ACK] Seq=204091 Ack=4803 Win=16088 Len=1448 TSval=1785879942 TSecr=1654347331"
"211","3.623950","10.0.0.101","192.168.0.3","TCP","1514","5000,35644","1448","5000  >  35644 [ACK] Seq=205539 Ack=4803 Win=16088 Len=1448 TSval=1785879942 TSecr=1654347331"
"212","3.623995","192.168.0.3","10.0.0.101","TCP","66","35644,5000","0","35644  >  5000 [ACK] Seq=6389 Ack=204091 Win=28956 Len=0 TSval=1654347362 TSecr=1785879942"
"213","3.624004","10.0.0.101","192.168.0.3","TCP","1514","5000,35644","1448","5000  >  35644 [ACK] Seq=206987 Ack=4803 Win=16088 Len=1448 TSval=1785879943 TSecr=1654347331"
"214","3.624019","10.0.0.101","192.168.0.3","TCP","1514","5000,35644","1448","5000  >  35644 [PSH, ACK] Seq=208435 Ack=4803 Win=16088 Len=1448 TSval=1785879943 TSecr=1654347331"
"215","3.624061","10.0.0.101","192.168.0.3","RSL","1514","5000,35644","1448","MODE MODIFY Negative ACKnowledge "
"216","3.624074","10.0.0.101","192.168.0.3","TCP","1514","5000,35644","1448","5000  >  35644 [ACK] Seq=211331 Ack=4803 Win=16088 Len=1448 TSval=1785879943 TSecr=1654347331"
"217","3.624085","10.0.0.101","192.168.0.3","TCP","1514","5000,35644","1448","5000  >  35644 [PSH, ACK] Seq=212779 Ack=4803 Win=16088 Len=1448 TSval=1785879943 TSecr=1654347331"
"218","3.624099","10.0.0.101","192.168.0.3","TCP","1514","5000,35644","1448","5000  >  35644 [ACK] Seq=214227 Ack=4803 Win=16088 Len=1448 TSval=1785879943 TSecr=1654347331"
"219","3.624076","192.168.0.3","10.0.0.101","TCP","66","35644,5000","0","35644  >  5000 [ACK] Seq=6389 Ack=206987 Win=28932 Len=0 TSval=1654347362 TSecr=1785879942"
"220","3.624143","192.168.0.3","10.0.0.101","TCP","66","35644,5000","0","35644  >  5000 [ACK] Seq=6389 Ack=209883 Win=28992 Len=0 TSval=1654347362 TSecr=1785879943"
"221","3.624149","10.0.0.101","192.168.0.3","TCP","1514","5000,35644","1448","5000  >  35644 [ACK] Seq=215675 Ack=4803 Win=16088 Len=1448 TSval=1785879943 TSecr=1654347331"
"222","3.624168","10.0.0.101","192.168.0.3","TCP","1514","5000,35644","1448","5000  >  35644 [PSH, ACK] Seq=217123 Ack=4803 Win=16088 Len=1448 TSval=1785879943 TSecr=1654347331"
"223","3.624184","10.0.0.101","192.168.0.3","TCP","1514","5000,35644","1448","5000  >  35644 [ACK] Seq=218571 Ack=4803 Win=16088 Len=1448 TSval=1785879943 TSecr=1654347331"
"224","3.624481","192.168.0.3","10.0.0.101","TCP","66","35644,5000","0","35644  >  5000 [ACK] Seq=6389 Ack=220019 Win=28904 Len=0 TSval=1654347362 TSecr=1785879943"
"225","3.632247","192.168.0.3","10.0.0.101","RSL","1514","35644,5000","1448","CHANnel ReQuireD "
"226","3.634250","10.0.0.101","192.168.0.3","TCP","1514","5000,35644","1448","5000  >  35644 [ACK] Seq=220019 Ack=4803 Win=16088 Len=1448 TSval=1785879943 TSecr=1654347331"
"227","3.634265","10.0.0.101","192.168.0.3","TCP","1514","5000,35644","1448","5000  >  35644 [PSH, ACK] Seq=221467 Ack=4803 Win=16088 Len=1448 TSval=1785879943 TSecr=1654347331"
"228","3.634279","10.0.0.101","192.168.0.3","TCP","1514","5000,35644","1448","5000  >  35644 [ACK] Seq=222915 Ack=4803 Win=16088 Len=1448 TSval=1785879943 TSecr=1654347331"
"229","3.634306","10.0.0.101","192.168.0.3","TCP","1514","5000,35644","1448","5000  >  35644 [PSH, ACK] Seq=224363 Ack=4803 Win=16088 Len=1448 TSval=1785879943 TSecr=1654347331"
"230","3.634334","10.0.0.101","192.168.0.3","TCP","1514","5000,35644","1448","5000  >  35644 [ACK] Seq=225811 Ack=4803 Win=16088 Len=1448 TSval=1785879943 TSecr=1654347331"
"231","3.634358","10.0.0.101","192.168.0.3","TCP","1514","5000,35644","1448","5000  >  35644 [ACK] Seq=227259 Ack=4803 Win=16088 Len=1448 TSval=1785879943 TSecr=1654347331"
"232","3.634366","10.0.0.101","192.168.0.3","TCP","1514","5000,35644","1448","5000  >  35644 [ACK] Seq=228707 Ack=4803 Win=16088 Len=1448 TSval=1785879943 TSecr=1654347331"
"233","3.634378","192.168.0.3","10.0.0.101","TCP","66","35644,5000","0","35644  >  5000 [ACK] Seq=7837 Ack=225811 Win=28968 Len=0 TSval=1654347372 TSecr=1785879943"
"234","3.634412","10.0.0.101","192.168.0.3","TCP","1514","5000,35644","1448","5000  >  35644 [PSH, ACK] Seq=230155 Ack=4803 Win=16088 Len=1448 TSval=1785879943 TSecr=1654347331"
"235","3.634434","10.0.0.101","192.168.0.3","TCP","1514","5000,35644","1448","5000  >  35644 [ACK] Seq=231603 Ack=4803 Win=16088 Len=1448 TSval=1785879943 TSecr=1654347331"
"236","3.634439","192.168.0.3","10.0.0.101","TCP","66","35644,5000","0","35644  >  5000 [ACK] Seq=7837 Ack=230155 Win=28932 Len=0 TSval=1654347372 TSecr=1785879943"
"237","3.634444","10.0.0.101","192.168.0.3","TCP","1514","5000,35644","1448","5000  >  35644 [PSH, ACK] Seq=233051 Ack=4803 Win=16088 Len=1448 TSval=1785879943 TSecr=1654347331"
"238","3.634460","10.0.0.101","192.168.0.3","TCP","1514","5000,35644","1448","5000  >  35644 [ACK] Seq=234499 Ack=4803 Win=16088 Len=1448 TSval=1785879943 TSecr=1654347331"
"239","3.634482","10.0.0.101","192.168.0.3","TCP","1514","5000,35644","1448","5000  >  35644 [ACK] Seq=235947 Ack=4803 Win=16088 Len=1448 TSval=1785879943 TSecr=1654347331"
"240","3.634508","10.0.0.101","192.168.0.3","TCP","1514","5000,35644","1448","5000  >  35644 [PSH, ACK] Seq=237395 Ack=4803 Win=16088 Len=1448 TSval=1785879943 TSecr=1654347331"
"241","3.634512","192.168.0.3","10.0.0.101","TCP","66","35644,5000","0","35644  >  5000 [ACK] Seq=7837 Ack=234499 Win=28896 Len=0 TSval=1654347372 TSecr=1785879943"
"242","3.634543","10.0.0.101","192.168.0.3","TCP","1514","5000,35644","1448","5000  >  35644 [ACK] Seq=238843 Ack=4803 Win=16088 Len=1448 TSval=1785879943 TSecr=1654347331"
"243","3.634555","10.0.0.101","192.168.0.3","TCP","1514","5000,35644","1448","5000  >  35644 [ACK] Seq=240291 Ack=4803 Win=16088 Len=1448 TSval=1785879943 TSecr=1654347331"
"244","3.634570","192.168.0.3","10.0.0.101","TCP","66","35644,5000","0","35644  >  5000 [ACK] Seq=7837 Ack=237395 Win=28872 Len=0 TSval=1654347373 TSecr=1785879943"
"245","3.634603","10.0.0.101","192.168.0.3","TCP","1514","5000,35644","1448","5000  >  35644 [PSH, ACK] Seq=241739 Ack=4803 Win=16088 Len=1448 TSval=1785879943 TSecr=1654347331"
"246","3.635343","192.168.0.3","10.0.0.101","TCP","66","35644,5000","0","35644  >  5000 [ACK] Seq=7837 Ack=243187 Win=28824 Len=0 TSval=1654347373 TSecr=1785879943"
"247","3.644757","10.0.0.101","192.168.0.3","TCP","1514","5000,35644","1448","5000  >  35644 [ACK] Seq=243187 Ack=4803 Win=16088 Len=1448 TSval=1785879943 TSecr=1654347331"
"248","3.644776","10.0.0.101","192.168.0.3","TCP","740","5000,35644","674","5000  >  35644 [PSH, ACK] Seq=244635 Ack=4803 Win=16088 Len=674 TSval=1785879949 TSecr=1654347341"
"249","3.644810","10.0.0.101","192.168.0.3","RSL","1514","5000,35644","1448","ip.access HANDOover CANDidate ENQuiry "
"250","3.644825","10.0.0.101","192.168.0.3","TCP","1514","5000,35644","1448","5000  >  35644 [PSH, ACK] Seq=246757 Ack=6251 Win=16088 Len=1448 TSval=1785879956 TSecr=1654347348"
"251","3.644843","192.168.0.3","10.0.0.101","TCP","66","35644,5000","0","35644  >  5000 [ACK] Seq=7837 Ack=245309 Win=28988 Len=0 TSval=1654347383 TSecr=1785879943"
