"No.","Time","Source","Destination","Protocol","Length","Port","Info"
"1","0.000000","10.0.0.104","192.168.0.3","TCP","66","5000,47214","5000  >  47214 [FIN, ACK] Seq=1 Ack=1 Win=1002 Len=0 TSval=1106505223 TSecr=4287614299"
"2","0.000235","192.168.0.3","10.0.0.104","TCP","66","47214,5000","47214  >  5000 [FIN, ACK] Seq=1 Ack=2 Win=1002 Len=0 TSval=4287807906 TSecr=1106505223"
"3","0.020113","10.0.0.104","192.168.0.3","TCP","66","5000,47214","5000  >  47214 [ACK] Seq=2 Ack=2 Win=1002 Len=0 TSval=1106505236 TSecr=4287807906"
"6","3.448465","10.0.0.101","192.168.0.3","RSL","602","5000,35644","CHANnel ReQuireD "
"7","3.448599","192.168.0.3","10.0.0.101","TCP","66","35644,5000","35644  >  5000 [ACK] Seq=1 Ack=537 Win=29004 Len=0 TSval=1644742033 TSecr=1776274863"
"10","8.679232","192.168.0.3","10.0.0.101","RSL","602","35644,5000","CHANnel ReQuireD "
"11","8.696242","10.0.0.101","192.168.0.3","TCP","66","5000,35644","5000  >  35644 [ACK] Seq=537 Ack=537 Win=6826 Len=0 TSval=1776280103 TSecr=1644747263"
"12","8.696265","10.0.0.101","192.168.0.3","RSL","602","5000,35644","CHANnel ReQuireD "
"13","8.696329","192.168.0.3","10.0.0.101","TCP","66","35644,5000","35644  >  5000 [ACK] Seq=537 Ack=1073 Win=29004 Len=0 TSval=1644747281 TSecr=1776280103"
"14","8.696713","192.168.0.3","10.0.0.101","RSL","602","35644,5000","CHANnel ReQuireD "
"15","8.726440","10.0.0.101","192.168.0.3","RSL","602","5000,35644","CHANnel ReQuireD "
"16","8.726511","192.168.0.3","10.0.0.101","TCP","66","35644,5000","35644  >  5000 [ACK] Seq=1073 Ack=1609 Win=29004 Len=0 TSval=1644747311 TSecr=1776280134"
"17","8.726891","192.168.0.3","10.0.0.101","RSL","602","35644,5000","CHANnel ReQuireD "
"18","8.756680","10.0.0.101","192.168.0.3","RSL","602","5000,35644","CHANnel ReQuireD "
"19","8.757229","192.168.0.3","10.0.0.101","RSL","602","35644,5000","CHANnel ReQuireD "
"20","8.796933","10.0.0.101","192.168.0.3","RSL","602","5000,35644","CHANnel ReQuireD "
"21","8.797674","192.168.0.3","10.0.0.101","RSL","602","35644,5000","CHANnel ReQuireD "
"22","8.837162","10.0.0.101","192.168.0.3","RSL","1514","5000,35644","NOTification CoMmanD "
"23","8.837190","10.0.0.101","192.168.0.3","TCP","1514","5000,35644","5000  >  35644 [PSH, ACK] Seq=4129 Ack=2681 Win=6826 Len=1448 TSval=1776280246 TSecr=1644747382"
"24","8.837198","10.0.0.101","192.168.0.3","SCCP (Int. ITU)","790","5000,35644","Unknown: 135 "
"25","8.837328","192.168.0.3","10.0.0.101","TCP","66","35644,5000","35644  >  5000 [ACK] Seq=2681 Ack=6301 Win=28980 Len=0 TSval=1644747422 TSecr=1776280246"
"26","8.847296","10.0.0.101","192.168.0.3","RSL","1514","5000,35644","ip.access HANDOover CANDidate ENQuiry "
"27","8.847320","10.0.0.101","192.168.0.3","TCP","1514","5000,35644","5000  >  35644 [PSH, ACK] Seq=7749 Ack=2681 Win=6826 Len=1448 TSval=1776280256 TSecr=1644747382"
"28","8.847391","10.0.0.101","192.168.0.3","TCP","1514","5000,35644","5000  >  35644 [ACK] Seq=9197 Ack=2681 Win=6826 Len=1448 TSval=1776280256 TSecr=1644747382"
"29","8.847405","10.0.0.101","192.168.0.3","TCP","1514","5000,35644","5000  >  35644 [PSH, ACK] Seq=10645 Ack=2681 Win=6826 Len=1448 TSval=1776280256 TSecr=1644747382"
"30","8.847419","10.0.0.101","192.168.0.3","TCP","1514","5000,35644","5000  >  35644 [ACK] Seq=12093 Ack=2681 Win=6826 Len=1448 TSval=1776280256 TSecr=1644747382"
"31","8.847424","192.168.0.3","10.0.0.101","TCP","66","35644,5000","35644  >  5000 [ACK] Seq=2681 Ack=9197 Win=28988 Len=0 TSval=1644747432 TSecr=1776280256"
"32","8.847552","192.168.0.3","10.0.0.101","TCP","66","35644,5000","35644  >  5000 [ACK] Seq=2681 Ack=12093 Win=28992 Len=0 TSval=1644747432 TSecr=1776280256"
"33","8.857514","10.0.0.101","192.168.0.3","TCP","580","5000,35644","5000  >  35644 [PSH, ACK] Seq=13541 Ack=2681 Win=6826 Len=514 TSval=1776280264 TSecr=1644747422"
"34","8.857532","10.0.0.101","192.168.0.3","RSL","1514","5000,35644","ip.access HANDOover CANDidate ENQuiry "
"35","8.857579","10.0.0.101","192.168.0.3","TCP","1514","5000,35644","5000  >  35644 [PSH, ACK] Seq=15503 Ack=2681 Win=6826 Len=1448 TSval=1776280267 TSecr=1644747422"
"36","8.857591","10.0.0.101","192.168.0.3","TCP","1514","5000,35644","5000  >  35644 [ACK] Seq=16951 Ack=2681 Win=6826 Len=1448 TSval=1776280267 TSecr=1644747422"
"37","8.857615","192.168.0.3","10.0.0.101","TCP","66","35644,5000","35644  >  5000 [ACK] Seq=2681 Ack=14055 Win=29004 Len=0 TSval=1644747442 TSecr=1776280256"
"38","8.857626","10.0.0.101","192.168.0.3","IPA","1514","5000,35644","MGCP (old) "
"39","8.857652","10.0.0.101","192.168.0.3","RSL","1514","5000,35644","DATA REQuest (DTAP) (CC) "
"40","8.857711","192.168.0.3","10.0.0.101","TCP","66","35644,5000","35644  >  5000 [ACK] Seq=2681 Ack=19847 Win=28956 Len=0 TSval=1644747442 TSecr=1776280267"
"41","8.867736","10.0.0.101","192.168.0.3","TCP","1514","5000,35644","5000  >  35644 [ACK] Seq=21295 Ack=2681 Win=6826 Len=1448 TSval=1776280279 TSecr=1644747432"
"42","8.867758","10.0.0.101","192.168.0.3","TCP","1514","5000,35644","5000  >  35644 [PSH, ACK] Seq=22743 Ack=2681 Win=6826 Len=1448 TSval=1776280279 TSecr=1644747432"
"43","8.867799","10.0.0.101","192.168.0.3","TCP","1514","5000,35644","5000  >  35644 [ACK] Seq=24191 Ack=2681 Win=6826 Len=1448 TSval=1776280279 TSecr=1644747432"
"44","8.867845","192.168.0.3","10.0.0.101","TCP","66","35644,5000","35644  >  5000 [ACK] Seq=2681 Ack=24191 Win=28992 Len=0 TSval=1644747452 TSecr=1776280267"
"45","8.867855","10.0.0.101","192.168.0.3","TCP","1514","5000,35644","5000  >  35644 [ACK] Seq=25639 Ack=2681 Win=6826 Len=1448 TSval=1776280279 TSecr=1644747432"
"46","8.867871","10.0.0.101","192.168.0.3","TCP","1514","5000,35644","5000  >  35644 [PSH, ACK] Seq=27087 Ack=2681 Win=6826 Len=1448 TSval=1776280279 TSecr=1644747432"
"47","8.867925","192.168.0.3","10.0.0.101","TCP","66","35644,5000","35644  >  5000 [ACK] Seq=2681 Ack=27087 Win=29004 Len=0 TSval=1644747452 TSecr=1776280279"
"48","8.868008","10.0.0.101","192.168.0.3","RSL","1514","5000,35644","MultiRate CODEC MOD ACKnowledge "
"49","8.868022","10.0.0.101","192.168.0.3","TCP","1514","5000,35644","5000  >  35644 [PSH, ACK] Seq=29983 Ack=2681 Win=6826 Len=1448 TSval=1776280279 TSecr=1644747432"
"50","8.868035","10.0.0.101","192.168.0.3","TCP","1514","5000,35644","5000  >  35644 [ACK] Seq=31431 Ack=2681 Win=6826 Len=1448 TSval=1776280279 TSecr=1644747432"
"51","8.868043","10.0.0.101","192.168.0.3","TCP","1514","5000,35644","5000  >  35644 [ACK] Seq=32879 Ack=2681 Win=6826 Len=1448 TSval=1776280279 TSecr=1644747432"
"52","8.868054","10.0.0.101","192.168.0.3","TCP","1514","5000,35644","5000  >  35644 [PSH, ACK] Seq=34327 Ack=2681 Win=6826 Len=1448 TSval=1776280279 TSecr=1644747432"
"53","8.868724","192.168.0.3","10.0.0.101","TCP","66","35644,5000","35644  >  5000 [ACK] Seq=2681 Ack=35775 Win=28932 Len=0 TSval=1644747453 TSecr=1776280279"
"54","8.869425","192.168.0.3","10.0.0.101","RSL","602","35644,5000","CHANnel ReQuireD "
"55","8.878075","10.0.0.101","192.168.0.3","TCP","1514","5000,35644","5000  >  35644 [ACK] Seq=35775 Ack=2681 Win=6826 Len=1448 TSval=1776280285 TSecr=1644747442"
"56","8.878095","10.0.0.101","192.168.0.3","TCP","1514","5000,35644","5000  >  35644 [PSH, ACK] Seq=37223 Ack=2681 Win=6826 Len=1448 TSval=1776280285 TSecr=1644747442"
"57","8.878119","10.0.0.101","192.168.0.3","RSL","1514","5000,35644","ip.access HANDOover CANDidate RESPonse "
"58","8.878207","192.168.0.3","10.0.0.101","TCP","66","35644,5000","35644  >  5000 [ACK] Seq=3217 Ack=40119 Win=28976 Len=0 TSval=1644747462 TSecr=1776280285"
"59","8.878373","10.0.0.101","192.168.0.3","IPA","1514","5000,35644","HSL Debug [Malformed Packet: length of contained item exceeds length of containing item]"
"60","8.878401","10.0.0.101","192.168.0.3","RSL","1514","5000,35644","CONNection FAILure "
"61","8.878409","10.0.0.101","192.168.0.3","RSL","1514","5000,35644","MultiRate CODEC MODification REQuest "
"62","8.878416","10.0.0.101","192.168.0.3","TCP","1514","5000,35644","5000  >  35644 [ACK] Seq=44463 Ack=2681 Win=6826 Len=1448 TSval=1776280285 TSecr=1644747442"
"63","8.878427","10.0.0.101","192.168.0.3","TCP","1514","5000,35644","5000  >  35644 [PSH, ACK] Seq=45911 Ack=2681 Win=6826 Len=1448 TSval=1776280285 TSecr=1644747442"
"64","8.878433","10.0.0.101","192.168.0.3","RSL","1420","5000,35644","Osmocom PRIMARY ETWS CMD "
"65","8.878440","10.0.0.101","192.168.0.3","RSL","1514","5000,35644","NOTification CoMmanD "
"66","8.878454","10.0.0.101","192.168.0.3","RSL","1514","5000,35644","unknown 107 "
"67","8.878481","192.168.0.3","10.0.0.101","TCP","66","35644,5000","35644  >  5000 [ACK] Seq=3217 Ack=43015 Win=28992 Len=0 TSval=1644747463 TSecr=1776280285"
"68","8.878565","192.168.0.3","10.0.0.101","TCP","66","35644,5000","35644  >  5000 [ACK] Seq=3217 Ack=51609 Win=28920 Len=0 TSval=1644747463 TSecr=1776280285"
"69","8.888457","10.0.0.101","192.168.0.3","TCP","1514","5000,35644","5000  >  35644 [ACK] Seq=51609 Ack=3217 Win=6826 Len=1448 TSval=1776280303 TSecr=1644747454"
"70","8.888479","10.0.0.101","192.168.0.3","TCP","1514","5000,35644","5000  >  35644 [ACK] Seq=53057 Ack=3217 Win=6826 Len=1448 TSval=1776280303 TSecr=1644747454"
"71","8.888509","10.0.0.101","192.168.0.3","TCP","1514","5000,35644","5000  >  35644 [PSH, ACK] Seq=54505 Ack=3217 Win=6826 Len=1448 TSval=1776280303 TSecr=1644747454"
"72","8.888546","10.0.0.101","192.168.0.3","TCP","1514","5000,35644","5000  >  35644 [ACK] Seq=55953 Ack=3217 Win=6826 Len=1448 TSval=1776280303 TSecr=1644747454"
"73","8.888557","192.168.0.3","10.0.0.101","TCP","66","35644,5000","35644  >  5000 [ACK] Seq=3217 Ack=54505 Win=28992 Len=0 TSval=1644747473 TSecr=1776280303"
"74","8.888561","10.0.0.101","192.168.0.3","TCP","1514","5000,35644","5000  >  35644 [ACK] Seq=57401 Ack=3217 Win=6826 Len=1448 TSval=1776280303 TSecr=1644747454"
"75","8.888634","10.0.0.101","192.168.0.3","TCP","1514","5000,35644","5000  >  35644 [PSH, ACK] Seq=58849 Ack=3217 Win=6826 Len=1448 TSval=1776280303 TSecr=1644747454"
"76","8.888641","192.168.0.3","10.0.0.101","TCP","66","35644,5000","35644  >  5000 [ACK] Seq=3217 Ack=57401 Win=28968 Len=0 TSval=1644747473 TSecr=1776280303"
"77","8.888659","10.0.0.101","192.168.0.3","TCP","1514","5000,35644","5000  >  35644 [ACK] Seq=60297 Ack=3217 Win=6826 Len=1448 TSval=1776280303 TSecr=1644747454"
"78","8.888692","10.0.0.101","192.168.0.3","TCP","1514","5000,35644","5000  >  35644 [PSH, ACK] Seq=61745 Ack=3217 Win=6826 Len=1448 TSval=1776280303 TSecr=1644747454"
"79","8.888693","192.168.0.3","10.0.0.101","TCP","66","35644,5000","35644  >  5000 [ACK] Seq=3217 Ack=60297 Win=29004 Len=0 TSval=1644747473 TSecr=1776280303"
"80","8.888705","10.0.0.101","192.168.0.3","TCP","1514","5000,35644","5000  >  35644 [ACK] Seq=63193 Ack=3217 Win=6826 Len=1448 TSval=1776280303 TSecr=1644747454"
"81","8.888749","10.0.0.101","192.168.0.3","TCP","1514","5000,35644","5000  >  35644 [ACK] Seq=64641 Ack=3217 Win=6826 Len=1448 TSval=1776280303 TSecr=1644747454"
"82","8.888761","10.0.0.101","192.168.0.3","RSL","1514","5000,35644","UNIT DATA REQuest "
"83","8.888770","10.0.0.101","192.168.0.3","TCP","1514","5000,35644","5000  >  35644 [ACK] Seq=67537 Ack=3217 Win=6826 Len=1448 TSval=1776280303 TSecr=1644747454 [TCP segment of a reassembled PDU]"
"84","8.888796","10.0.0.101","192.168.0.3","TCP","1514","5000,35644","5000  >  35644 [ACK] Seq=68985 Ack=3217 Win=6826 Len=1448 TSval=1776280303 TSecr=1644747454 [TCP segment of a reassembled PDU]"
"85","8.888828","10.0.0.101","192.168.0.3","TCP","1514","5000,35644","5000  >  35644 [PSH, ACK] Seq=70433 Ack=3217 Win=6826 Len=1448 TSval=1776280303 TSecr=1644747454 [TCP segment of a reassembled PDU]"
"86","8.888883","10.0.0.101","192.168.0.3","TCP","1514","5000,35644","5000  >  35644 [ACK] Seq=71881 Ack=3217 Win=6826 Len=1448 TSval=1776280303 TSecr=1644747454 [TCP segment of a reassembled PDU]"
"87","8.888898","10.0.0.101","192.168.0.3","TCP","1514","5000,35644","5000  >  35644 [ACK] Seq=73329 Ack=3217 Win=6826 Len=1448 TSval=1776280303 TSecr=1644747454 [TCP segment of a reassembled PDU]"
"88","8.889276","192.168.0.3","10.0.0.101","RSL","602","35644,5000","CHANnel ReQuireD "
"89","8.899002","10.0.0.101","192.168.0.3","TCP","1514","5000,35644","5000  >  35644 [PSH, ACK] Seq=74777 Ack=3217 Win=6826 Len=1448 TSval=1776280303 TSecr=1644747454 [TCP segment of a reassembled PDU]"
"90","8.899025","10.0.0.101","192.168.0.3","TCP","1514","5000,35644","5000  >  35644 [ACK] Seq=76225 Ack=3217 Win=6826 Len=1448 TSval=1776280303 TSecr=1644747454 [TCP segment of a reassembled PDU]"
"91","8.899050","10.0.0.101","192.168.0.3","TCP","1514","5000,35644","5000  >  35644 [ACK] Seq=77673 Ack=3217 Win=6826 Len=1448 TSval=1776280303 TSecr=1644747454 [TCP segment of a reassembled PDU]"
"92","8.899086","192.168.0.3","10.0.0.101","TCP","66","35644,5000","35644  >  5000 [ACK] Seq=3753 Ack=77673 Win=28992 Len=0 TSval=1644747483 TSecr=1776280303"
"93","8.899104","10.0.0.101","192.168.0.3","THRIFT","1514","5000,35644","ONEWAY \357\277\275)\031\357\277\275\357\277\275T\357\277\275\n\357\277\275`\357\277\275\357\277\275\357\277\275\357\277\275\357\277\275\357\277\275\357\277\275\306\262)\357\277\275\0207{\003%l\357\277\275\357\277\275s;5\357\277\275\357\277\275\030E"",\357\277\275\030Q\004\357\277\275`h\357\277\275\357\277\275\357\277\275\357\277\2750\357\277\275\357\277\275\357\277\275\t\357\277\275N\357\277\275\357\277\275k\357\277\275R]\036\357\277\275e\357\277\275\357\277\275;,\357\277\275Ch\023h1?\357\277\275\357\277\275I\357\277\275\357\277\275Z\025O\357\277\275-\354\272\257\357\277\275'\rA!\357\277\275$9b\357\277\275\357\277\275\357\277\275\026\357\277\275fOZ\324\202z\0053\357\277\275\035\357\277\275:YdXG\357\277\275\034\357\277\275[\357\277\275\tV\001"
"94","8.899129","10.0.0.101","192.168.0.3","TCP","1514","5000,35644","5000  >  35644 [ACK] Seq=80569 Ack=3217 Win=6826 Len=1448 TSval=1776280303 TSecr=1644747454"
"95","8.899149","10.0.0.101","192.168.0.3","TCP","1514","5000,35644","5000  >  35644 [ACK] Seq=82017 Ack=3217 Win=6826 Len=1448 TSval=1776280303 TSecr=1644747454"
"96","8.899165","192.168.0.3","10.0.0.101","TCP","66","35644,5000","35644  >  5000 [ACK] Seq=3753 Ack=80569 Win=29004 Len=0 TSval=1644747483 TSecr=1776280303"
"97","8.899176","10.0.0.101","192.168.0.3","TCP","1514","5000,35644","5000  >  35644 [PSH, ACK] Seq=83465 Ack=3217 Win=6826 Len=1448 TSval=1776280303 TSecr=1644747454"
"98","8.899223","192.168.0.3","10.0.0.101","TCP","66","35644,5000","35644  >  5000 [ACK] Seq=3753 Ack=84913 Win=28980 Len=0 TSval=1644747483 TSecr=1776280303"
"99","8.899247","10.0.0.101","192.168.0.3","RSL","1514","5000,35644","ERROR INDication "
"100","8.899259","10.0.0.101","192.168.0.3","TCP","1514","5000,35644","5000  >  35644 [ACK] Seq=86361 Ack=3217 Win=6826 Len=1448 TSval=1776280306 TSecr=1644747462"
"101","8.899283","10.0.0.101","192.168.0.3","TCP","1514","5000,35644","5000  >  35644 [PSH, ACK] Seq=87809 Ack=3217 Win=6826 Len=1448 TSval=1776280306 TSecr=1644747462"
"102","8.899294","10.0.0.101","192.168.0.3","TCP","414","5000,35644","5000  >  35644 [PSH, ACK] Seq=89257 Ack=3217 Win=6826 Len=348 TSval=1776280306 TSecr=1644747463"
"103","8.899304","10.0.0.101","192.168.0.3","RSL","1514","5000,35644","NOTification CoMmanD "
"104","8.899327","10.0.0.101","192.168.0.3","TCP","1514","5000,35644","5000  >  35644 [PSH, ACK] Seq=91053 Ack=3217 Win=6826 Len=1448 TSval=1776280313 TSecr=1644747463"
"105","8.899328","192.168.0.3","10.0.0.101","TCP","66","35644,5000","35644  >  5000 [ACK] Seq=3753 Ack=87809 Win=28992 Len=0 TSval=1644747484 TSecr=1776280306"
"106","8.899786","192.168.0.3","10.0.0.101","TCP","66","35644,5000","35644  >  5000 [ACK] Seq=3753 Ack=92501 Win=28944 Len=0 TSval=1644747484 TSecr=1776280306"
"107","8.909455","10.0.0.101","192.168.0.3","TCP","1514","5000,35644","5000  >  35644 [ACK] Seq=92501 Ack=3753 Win=6826 Len=1448 TSval=1776280323 TSecr=1644747473"
"108","8.909486","10.0.0.101","192.168.0.3","TCP","1514","5000,35644","5000  >  35644 [ACK] Seq=93949 Ack=3753 Win=6826 Len=1448 TSval=1776280323 TSecr=1644747473"
"109","8.909525","10.0.0.101","192.168.0.3","TCP","1514","5000,35644","5000  >  35644 [PSH, ACK] Seq=95397 Ack=3753 Win=6826 Len=1448 TSval=1776280323 TSecr=1644747473"
"110","8.909572","192.168.0.3","10.0.0.101","RSL","1138","35644,5000","CHANnel ReQuireD "
"111","8.909602","10.0.0.101","192.168.0.3","TCP","1514","5000,35644","5000  >  35644 [ACK] Seq=96845 Ack=3753 Win=6826 Len=1448 TSval=1776280323 TSecr=1644747473"
"112","8.909610","10.0.0.101","192.168.0.3","TCP","1514","5000,35644","5000  >  35644 [ACK] Seq=98293 Ack=3753 Win=6826 Len=1448 TSval=1776280323 TSecr=1644747473"
"113","8.909626","10.0.0.101","192.168.0.3","TCP","1514","5000,35644","5000  >  35644 [PSH, ACK] Seq=99741 Ack=3753 Win=6826 Len=1448 TSval=1776280323 TSecr=1644747473"
"114","8.909676","192.168.0.3","10.0.0.101","TCP","66","35644,5000","35644  >  5000 [ACK] Seq=4825 Ack=96845 Win=28976 Len=0 TSval=1644747494 TSecr=1776280323"
"115","8.909717","10.0.0.101","192.168.0.3","RSL","1514","5000,35644","PHYsical CONTEXT CONFirm "
"116","8.909725","10.0.0.101","192.168.0.3","TCP","1514","5000,35644","5000  >  35644 [PSH, ACK] Seq=102637 Ack=3753 Win=6826 Len=1448 TSval=1776280323 TSecr=1644747473"
"117","8.909732","10.0.0.101","192.168.0.3","RSL","1514","5000,35644","unknown 14 "
"118","8.909781","192.168.0.3","10.0.0.101","TCP","66","35644,5000","35644  >  5000 [ACK] Seq=4825 Ack=99741 Win=28992 Len=0 TSval=1644747494 TSecr=1776280323"
"119","8.909817","10.0.0.101","192.168.0.3","TCP","1514","5000,35644","5000  >  35644 [ACK] Seq=105533 Ack=3753 Win=6826 Len=1448 TSval=1776280323 TSecr=1644747473"
"120","8.909827","10.0.0.101","192.168.0.3","TCP","1514","5000,35644","5000  >  35644 [PSH, ACK] Seq=106981 Ack=3753 Win=6826 Len=1448 TSval=1776280323 TSecr=1644747473"
"121","8.909866","10.0.0.101","192.168.0.3","TCP","1514","5000,35644","5000  >  35644 [ACK] Seq=108429 Ack=3753 Win=6826 Len=1448 TSval=1776280323 TSecr=1644747473"
"122","8.909883","10.0.0.101","192.168.0.3","TCP","1514","5000,35644","5000  >  35644 [ACK] Seq=109877 Ack=3753 Win=6826 Len=1448 TSval=1776280323 TSecr=1644747473"
"123","8.909891","10.0.0.101","192.168.0.3","TCP","1514","5000,35644","5000  >  35644 [PSH, ACK] Seq=111325 Ack=3753 Win=6826 Len=1448 TSval=1776280323 TSecr=1644747473"
"124","8.909946","10.0.0.101","192.168.0.3","SCCP (Int. ITU)","1514","5000,35644","Unknown: 129 "
"125","8.909956","10.0.0.101","192.168.0.3","TCP","1514","5000,35644","5000  >  35644 [ACK] Seq=114221 Ack=3753 Win=6826 Len=1448 TSval=1776280323 TSecr=1644747473"
"126","8.909963","192.168.0.3","10.0.0.101","TCP","66","35644,5000","35644  >  5000 [ACK] Seq=4825 Ack=112773 Win=28884 Len=0 TSval=1644747494 TSecr=1776280323"
"127","8.910007","192.168.0.3","10.0.0.101","TCP","66","35644,5000","35644  >  5000 [ACK] Seq=4825 Ack=115669 Win=28860 Len=0 TSval=1644747494 TSecr=1776280323"
"128","8.919993","10.0.0.101","192.168.0.3","TCP","1514","5000,35644","5000  >  35644 [PSH, ACK] Seq=115669 Ack=3753 Win=6826 Len=1448 TSval=1776280323 TSecr=1644747473"
"129","8.920013","10.0.0.101","192.168.0.3","TCP","1514","5000,35644","5000  >  35644 [ACK] Seq=117117 Ack=3753 Win=6826 Len=1448 TSval=1776280323 TSecr=1644747473"
"130","8.920070","192.168.0.3","10.0.0.101","TCP","66","35644,5000","35644  >  5000 [ACK] Seq=4825 Ack=118565 Win=28992 Len=0 TSval=1644747504 TSecr=1776280323"
"131","8.920430","10.0.0.101","192.168.0.3","TCP","1514","5000,35644","5000  >  35644 [ACK] Seq=118565 Ack=3753 Win=6826 Len=1448 TSval=1776280323 TSecr=1644747473"
"132","8.920455","10.0.0.101","192.168.0.3","RSL","1514","5000,35644","ip.access PDCH DEACTIVATION NACK "
"133","8.920464","10.0.0.101","192.168.0.3","TCP","276","5000,35644","5000  >  35644 [PSH, ACK] Seq=121461 Ack=3753 Win=6826 Len=210 TSval=1776280327 TSecr=1644747484"
"134","8.920471","10.0.0.101","192.168.0.3","RSL","1514","5000,35644","ip.access HANDOover CANDidate ENQuiry "
"135","8.920479","10.0.0.101","192.168.0.3","TCP","1514","5000,35644","5000  >  35644 [PSH, ACK] Seq=123119 Ack=3753 Win=6826 Len=1448 TSval=1776280333 TSecr=1644747484"
"136","8.920490","10.0.0.101","192.168.0.3","TCP","1514","5000,35644","5000  >  35644 [ACK] Seq=124567 Ack=3753 Win=6826 Len=1448 TSval=1776280333 TSecr=1644747484"
"137","8.920497","10.0.0.101","192.168.0.3","TCP","1514","5000,35644","5000  >  35644 [ACK] Seq=126015 Ack=3753 Win=6826 Len=1448 TSval=1776280333 TSecr=1644747484"
"138","8.920512","10.0.0.101","192.168.0.3","TCP","1514","5000,35644","5000  >  35644 [PSH, ACK] Seq=127463 Ack=3753 Win=6826 Len=1448 TSval=1776280333 TSecr=1644747484"
"139","8.920520","10.0.0.101","192.168.0.3","TCP","1514","5000,35644","5000  >  35644 [ACK] Seq=128911 Ack=3753 Win=6826 Len=1448 TSval=1776280333 TSecr=1644747484"
"140","8.920528","10.0.0.101","192.168.0.3","RSL","1514","5000,35644","ip.access PDCH DEACTIVATION ACK "
"141","8.920539","10.0.0.101","192.168.0.3","TCP","1514","5000,35644","5000  >  35644 [PSH, ACK] Seq=131807 Ack=3753 Win=6826 Len=1448 TSval=1776280333 TSecr=1644747484"
"142","8.920547","10.0.0.101","192.168.0.3","TCP","1514","5000,35644","5000  >  35644 [ACK] Seq=133255 Ack=3753 Win=6826 Len=1448 TSval=1776280333 TSecr=1644747484"
"143","8.920556","10.0.0.101","192.168.0.3","TCP","1514","5000,35644","5000  >  35644 [ACK] Seq=134703 Ack=3753 Win=6826 Len=1448 TSval=1776280333 TSecr=1644747484"
"144","8.920567","10.0.0.101","192.168.0.3","TCP","1514","5000,35644","5000  >  35644 [PSH, ACK] Seq=136151 Ack=3753 Win=6826 Len=1448 TSval=1776280333 TSecr=1644747484"
"145","8.920638","192.168.0.3","10.0.0.101","TCP","66","35644,5000","35644  >  5000 [ACK] Seq=4825 Ack=121461 Win=28992 Len=0 TSval=1644747505 TSecr=1776280323"
"146","8.920718","192.168.0.3","10.0.0.101","TCP","66","35644,5000","35644  >  5000 [ACK] Seq=4825 Ack=137599 Win=28844 Len=0 TSval=1644747505 TSecr=1776280327"
"148","8.927639","192.168.0.3","10.0.0.101","RSL","1514","35644,5000","PAGING CoMmanD "
"149","8.930535","10.0.0.101","192.168.0.3","TCP","1514","5000,35644","5000  >  35644 [ACK] Seq=137599 Ack=4825 Win=6826 Len=1448 TSval=1776280344 TSecr=1644747494"
"150","8.930551","10.0.0.101","192.168.0.3","RSL","1514","5000,35644","unknown 88 "
"151","8.930568","10.0.0.101","192.168.0.3","TCP","1514","5000,35644","5000  >  35644 [PSH, ACK] Seq=140495 Ack=4825 Win=6826 Len=1448 TSval=1776280344 TSecr=1644747494"
"152","8.930645","192.168.0.3","10.0.0.101","TCP","204","35644,5000","35644  >  5000 [PSH, ACK] Seq=6273 Ack=140495 Win=28992 Len=138 TSval=1644747515 TSecr=1776280344"
"153","8.930748","10.0.0.101","192.168.0.3","TCP","1514","5000,35644","5000  >  35644 [ACK] Seq=141943 Ack=4825 Win=6826 Len=1448 TSval=1776280344 TSecr=1644747494"
"154","8.930766","10.0.0.101","192.168.0.3","TCP","1514","5000,35644","5000  >  35644 [ACK] Seq=143391 Ack=4825 Win=6826 Len=1448 TSval=1776280344 TSecr=1644747494"
"155","8.930779","10.0.0.101","192.168.0.3","TCP","1514","5000,35644","5000  >  35644 [PSH, ACK] Seq=144839 Ack=4825 Win=6826 Len=1448 TSval=1776280344 TSecr=1644747494"
"156","8.930784","10.0.0.101","192.168.0.3","TCP","1514","5000,35644","5000  >  35644 [ACK] Seq=146287 Ack=4825 Win=6826 Len=1448 TSval=1776280344 TSecr=1644747494"
"157","8.930790","10.0.0.101","192.168.0.3","RSL","1514","5000,35644","unknown 80 "
"158","8.930798","10.0.0.101","192.168.0.3","RSL","1514","5000,35644","unknown 107 "
"159","8.930803","10.0.0.101","192.168.0.3","TCP","1514","5000,35644","5000  >  35644 [ACK] Seq=150631 Ack=4825 Win=6826 Len=1448 TSval=1776280344 TSecr=1644747494"
"160","8.930808","10.0.0.101","192.168.0.3","TCP","1514","5000,35644","5000  >  35644 [PSH, ACK] Seq=152079 Ack=4825 Win=6826 Len=1448 TSval=1776280344 TSecr=1644747494"
"161","8.930820","192.168.0.3","10.0.0.101","TCP","66","35644,5000","35644  >  5000 [ACK] Seq=6411 Ack=143391 Win=29004 Len=0 TSval=1644747515 TSecr=1776280344"
"162","8.930823","10.0.0.101","192.168.0.3","TCP","1514","5000,35644","5000  >  35644 [ACK] Seq=153527 Ack=4825 Win=6826 Len=1448 TSval=1776280344 TSecr=1644747494"
"163","8.930901","10.0.0.101","192.168.0.3","TCP","1514","5000,35644","5000  >  35644 [ACK] Seq=154975 Ack=4825 Win=6826 Len=1448 TSval=1776280344 TSecr=1644747494"
"164","8.930922","10.0.0.101","192.168.0.3","TCP","1514","5000,35644","5000  >  35644 [PSH, ACK] Seq=156423 Ack=4825 Win=6826 Len=1448 TSval=1776280344 TSecr=1644747494"
"165","8.930929","10.0.0.101","192.168.0.3","TCP","1514","5000,35644","5000  >  35644 [ACK] Seq=157871 Ack=4825 Win=6826 Len=1448 TSval=1776280344 TSecr=1644747494"
"166","8.930973","10.0.0.101","192.168.0.3","TCP","1514","5000,35644","5000  >  35644 [ACK] Seq=159319 Ack=4825 Win=6826 Len=1448 TSval=1776280344 TSecr=1644747494"
"167","8.931082","192.168.0.3","10.0.0.101","TCP","66","35644,5000","35644  >  5000 [ACK] Seq=6411 Ack=160767 Win=28856 Len=0 TSval=1644747515 TSecr=1776280344"
"168","8.941099","10.0.0.101","192.168.0.3","TCP","1514","5000,35644","5000  >  35644 [PSH, ACK] Seq=160767 Ack=4825 Win=6826 Len=1448 TSval=1776280344 TSecr=1644747494"
"169","8.941116","10.0.0.101","192.168.0.3","TCP","1514","5000,35644","5000  >  35644 [ACK] Seq=162215 Ack=4825 Win=6826 Len=1448 TSval=1776280344 TSecr=1644747494"
"170","8.941124","10.0.0.101","192.168.0.3","TCP","1514","5000,35644","5000  >  35644 [ACK] Seq=163663 Ack=4825 Win=6826 Len=1448 TSval=1776280344 TSecr=1644747494"
"171","8.941184","10.0.0.101","192.168.0.3","TCP","1514","5000,35644","5000  >  35644 [PSH, ACK] Seq=165111 Ack=4825 Win=6826 Len=1448 TSval=1776280344 TSecr=1644747494"
"172","8.941188","192.168.0.3","10.0.0.101","TCP","66","35644,5000","35644  >  5000 [ACK] Seq=6411 Ack=165111 Win=28980 Len=0 TSval=1644747525 TSecr=1776280344"
"173","8.941200","10.0.0.101","192.168.0.3","RSL","1514","5000,35644","unknown 80 "
"174","8.941216","10.0.0.101","192.168.0.3","TCP","1514","5000,35644","5000  >  35644 [PSH, ACK] Seq=168007 Ack=4825 Win=6826 Len=1448 TSval=1776280344 TSecr=1644747494"
"175","8.941248","10.0.0.101","192.168.0.3","TCP","1514","5000,35644","5000  >  35644 [ACK] Seq=169455 Ack=4825 Win=6826 Len=1448 TSval=1776280344 TSecr=1644747494"
"176","8.941272","10.0.0.101","192.168.0.3","TCP","1514","5000,35644","5000  >  35644 [ACK] Seq=170903 Ack=4825 Win=6826 Len=1448 TSval=1776280344 TSecr=1644747494"
"177","8.941286","192.168.0.3","10.0.0.101","TCP","66","35644,5000","35644  >  5000 [ACK] Seq=6411 Ack=169455 Win=28944 Len=0 TSval=1644747526 TSecr=1776280344"
"178","8.941305","10.0.0.101","192.168.0.3","TCP","1514","5000,35644","5000  >  35644 [PSH, ACK] Seq=172351 Ack=4825 Win=6826 Len=1448 TSval=1776280344 TSecr=1644747494"
"179","8.941326","10.0.0.101","192.168.0.3","TCP","204","5000,35644","5000  >  35644 [PSH, ACK] Seq=173799 Ack=4825 Win=6826 Len=138 TSval=1776280348 TSecr=1644747505"
"180","8.941328","192.168.0.3","10.0.0.101","TCP","66","35644,5000","35644  >  5000 [ACK] Seq=6411 Ack=172351 Win=28920 Len=0 TSval=1644747526 TSecr=1776280344"
"181","8.941349","10.0.0.101","192.168.0.3","RSL","1514","5000,35644","ip.access HANDOover CANDidate ENQuiry "
"182","8.941379","10.0.0.101","192.168.0.3","RSL","1514","5000,35644","CONNection FAILure "
"183","8.941385","192.168.0.3","10.0.0.101","TCP","66","35644,5000","35644  >  5000 [ACK] Seq=6411 Ack=173937 Win=28896 Len=0 TSval=1644747526 TSecr=1776280344"
"184","8.941413","10.0.0.101","192.168.0.3","TCP","1514","5000,35644","5000  >  35644 [ACK] Seq=176833 Ack=6273 Win=6826 Len=1448 TSval=1776280354 TSecr=1644747512"
"185","8.941430","192.168.0.3","10.0.0.101","TCP","66","35644,5000","35644  >  5000 [ACK] Seq=6411 Ack=176833 Win=28992 Len=0 TSval=1644747526 TSecr=1776280354"
"186","8.941440","10.0.0.101","192.168.0.3","TCP","1514","5000,35644","5000  >  35644 [ACK] Seq=178281 Ack=6273 Win=6826 Len=1448 TSval=1776280354 TSecr=1644747512"
"187","8.941496","10.0.0.101","192.168.0.3","TCP","1514","5000,35644","5000  >  35644 [PSH, ACK] Seq=179729 Ack=6273 Win=6826 Len=1448 TSval=1776280354 TSecr=1644747512"
"188","8.941515","10.0.0.101","192.168.0.3","TCP","1514","5000,35644","5000  >  35644 [ACK] Seq=181177 Ack=6273 Win=6826 Len=1448 TSval=1776280354 TSecr=1644747512"
"189","8.941523","192.168.0.3","10.0.0.101","TCP","66","35644,5000","35644  >  5000 [ACK] Seq=6411 Ack=179729 Win=28992 Len=0 TSval=1644747526 TSecr=1776280354"
"190","8.942121","192.168.0.3","10.0.0.101","TCP","66","35644,5000","35644  >  5000 [ACK] Seq=6411 Ack=182625 Win=28968 Len=0 TSval=1644747526 TSecr=1776280354"
"191","8.951637","10.0.0.101","192.168.0.3","TCP","1514","5000,35644","5000  >  35644 [ACK] Seq=182625 Ack=6273 Win=6826 Len=1448 TSval=1776280354 TSecr=1644747512"
"192","8.951657","10.0.0.101","192.168.0.3","TCP","1514","5000,35644","5000  >  35644 [PSH, ACK] Seq=184073 Ack=6273 Win=6826 Len=1448 TSval=1776280354 TSecr=1644747512"
"193","8.951666","10.0.0.101","192.168.0.3","TCP","1514","5000,35644","5000  >  35644 [ACK] Seq=185521 Ack=6273 Win=6826 Len=1448 TSval=1776280354 TSecr=1644747512"
"194","8.951686","10.0.0.101","192.168.0.3","TCP","1514","5000,35644","5000  >  35644 [PSH, ACK] Seq=186969 Ack=6273 Win=6826 Len=1448 TSval=1776280354 TSecr=1644747512"
"195","8.951779","192.168.0.3","10.0.0.101","TCP","66","35644,5000","35644  >  5000 [ACK] Seq=6411 Ack=185521 Win=28988 Len=0 TSval=1644747536 TSecr=1776280354"
"196","8.951873","192.168.0.3","10.0.0.101","TCP","66","35644,5000","35644  >  5000 [ACK] Seq=6411 Ack=188417 Win=28964 Len=0 TSval=1644747536 TSecr=1776280354"
"197","8.952280","192.168.0.3","10.0.0.101","RSL","1514","35644,5000","PAGING CoMmanD "
"198","8.971903","10.0.0.101","192.168.0.3","TCP","66","5000,35644","5000  >  35644 [ACK] Seq=188417 Ack=7859 Win=6826 Len=0 TSval=1776280379 TSecr=1644747515"
"199","8.971971","192.168.0.3","10.0.0.101","TCP","740","35644,5000","35644  >  5000 [PSH, ACK] Seq=7859 Ack=188417 Win=29004 Len=674 TSval=1644747556 TSecr=1776280379"
"200","9.002109","10.0.0.101","192.168.0.3","RSL","602","5000,35644","CHANnel ReQuireD "
"201","9.002176","192.168.0.3","10.0.0.101","RSL","602","35644,5000","CHANnel ReQuireD "
"202","9.062474","10.0.0.101","192.168.0.3","TCP","66","5000,35644","5000  >  35644 [ACK] Seq=188953 Ack=9069 Win=6826 Len=0 TSval=1776280470 TSecr=1644747586"
"203","9.062491","10.0.0.101","192.168.0.3","RSL","602","5000,35644","CHANnel ReQuireD "
"204","9.062557","192.168.0.3","10.0.0.101","RSL","602","35644,5000","CHANnel ReQuireD "
"205","9.103484","192.168.0.3","10.0.0.101","TCP","66","35644,5000","35644  >  5000 [ACK] Seq=9605 Ack=189489 Win=29004 Len=0 TSval=1644747688 TSecr=1776280479"
"206","9.122851","10.0.0.101","192.168.0.3","RSL","602","5000,35644","CHANnel ReQuireD "
"207","9.122929","192.168.0.3","10.0.0.101","RSL","602","35644,5000","CHANnel ReQuireD "
"208","9.163136","10.0.0.101","192.168.0.3","RSL","1514","5000,35644","NOTification CoMmanD "
"209","9.163152","10.0.0.101","192.168.0.3","TCP","1514","5000,35644","5000  >  35644 [ACK] Seq=191473 Ack=10141 Win=6826 Len=1448 TSval=1776280570 TSecr=1644747707"
"210","9.163160","10.0.0.101","192.168.0.3","TCP","790","5000,35644","5000  >  35644 [PSH, ACK] Seq=192921 Ack=10141 Win=6826 Len=724 TSval=1776280570 TSecr=1644747707"
"211","9.163223","192.168.0.3","10.0.0.101","RSL","602","35644,5000","CHANnel ReQuireD "
"212","9.183306","10.0.0.101","192.168.0.3","RSL","602","5000,35644","CHANnel ReQuireD "
"213","9.183496","192.168.0.3","10.0.0.101","TCP","66","35644,5000","35644  >  5000 [ACK] Seq=10677 Ack=194181 Win=29004 Len=0 TSval=1644747768 TSecr=1776280590"
"214","9.203454","10.0.0.101","192.168.0.3","RSL","602","5000,35644","CHANnel ReQuireD "
"215","9.211196","192.168.0.3","10.0.0.101","RSL","602","35644,5000","CHANnel ReQuireD "
"216","9.243719","10.0.0.101","192.168.0.3","RSL","1514","5000,35644","NOTification CoMmanD "
"217","9.243743","10.0.0.101","192.168.0.3","RSL","1514","5000,35644","unknown 100 "
"218","9.243767","10.0.0.101","192.168.0.3","TCP","790","5000,35644","5000  >  35644 [PSH, ACK] Seq=197613 Ack=11213 Win=6826 Len=724 TSval=1776280651 TSecr=1644747795"
"219","9.243902","192.168.0.3","10.0.0.101","TCP","66","35644,5000","35644  >  5000 [ACK] Seq=11213 Ack=198337 Win=29004 Len=0 TSval=1644747828 TSecr=1776280651"
"220","9.253851","10.0.0.101","192.168.0.3","RSL","1514","5000,35644","ip.access HANDOover CANDidate ENQuiry "
"221","9.254228","10.0.0.101","192.168.0.3","TCP","1514","5000,35644","5000  >  35644 [PSH, ACK] Seq=199785 Ack=11213 Win=6826 Len=1448 TSval=1776280668 TSecr=1644747795"
"222","9.254255","10.0.0.101","192.168.0.3","TCP","1514","5000,35644","5000  >  35644 [ACK] Seq=201233 Ack=11213 Win=6826 Len=1448 TSval=1776280668 TSecr=1644747795"
"223","9.254263","10.0.0.101","192.168.0.3","TCP","1514","5000,35644","5000  >  35644 [ACK] Seq=202681 Ack=11213 Win=6826 Len=1448 TSval=1776280668 TSecr=1644747795"
"224","9.254273","10.0.0.101","192.168.0.3","TCP","1514","5000,35644","5000  >  35644 [PSH, ACK] Seq=204129 Ack=11213 Win=6826 Len=1448 TSval=1776280668 TSecr=1644747795"
"225","9.254281","10.0.0.101","192.168.0.3","TCP","1514","5000,35644","5000  >  35644 [ACK] Seq=205577 Ack=11213 Win=6826 Len=1448 TSval=1776280668 TSecr=1644747795"
"226","9.254288","10.0.0.101","192.168.0.3","RSL","1514","5000,35644","unknown 16 unknown 0xb5 "
"227","9.254300","10.0.0.101","192.168.0.3","TCP","1514","5000,35644","5000  >  35644 [PSH, ACK] Seq=208473 Ack=11213 Win=6826 Len=1448 TSval=1776280668 TSecr=1644747795"
"228","9.254308","10.0.0.101","192.168.0.3","TCP","1514","5000,35644","5000  >  35644 [ACK] Seq=209921 Ack=11213 Win=6826 Len=1448 TSval=1776280668 TSecr=1644747795"
"229","9.254315","10.0.0.101","192.168.0.3","TCP","1514","5000,35644","5000  >  35644 [ACK] Seq=211369 Ack=11213 Win=6826 Len=1448 TSval=1776280668 TSecr=1644747795"
"230","9.254325","10.0.0.101","192.168.0.3","TCP","1514","5000,35644","5000  >  35644 [PSH, ACK] Seq=212817 Ack=11213 Win=6826 Len=1448 TSval=1776280668 TSecr=1644747795"
"231","9.254456","192.168.0.3","10.0.0.101","TCP","66","35644,5000","35644  >  5000 [ACK] Seq=11213 Ack=201233 Win=29004 Len=0 TSval=1644747839 TSecr=1776280668"
"232","9.254497","192.168.0.3","10.0.0.101","TCP","66","35644,5000","35644  >  5000 [ACK] Seq=11213 Ack=214265 Win=28892 Len=0 TSval=1644747839 TSecr=1776280668"
"233","9.264195","10.0.0.101","192.168.0.3","TCP","696","5000,35644","5000  >  35644 [PSH, ACK] Seq=214265 Ack=11213 Win=6826 Len=630 TSval=1776280671 TSecr=1644747828"
"234","9.264229","10.0.0.101","192.168.0.3","RSL","1514","5000,35644","ip.access HANDOover CANDidate ENQuiry "
"235","9.264294","10.0.0.101","192.168.0.3","TCP","1514","5000,35644","5000  >  35644 [PSH, ACK] Seq=216343 Ack=11213 Win=6826 Len=1448 TSval=1776280678 TSecr=1644747828"
"236","9.264309","10.0.0.101","192.168.0.3","TCP","1514","5000,35644","5000  >  35644 [ACK] Seq=217791 Ack=11213 Win=6826 Len=1448 TSval=1776280679 TSecr=1644747828"
"237","9.264359","10.0.0.101","192.168.0.3","TCP","1514","5000,35644","5000  >  35644 [ACK] Seq=219239 Ack=11213 Win=6826 Len=1448 TSval=1776280679 TSecr=1644747828"
"238","9.264382","10.0.0.101","192.168.0.3","TCP","1514","5000,35644","5000  >  35644 [PSH, ACK] Seq=220687 Ack=11213 Win=6826 Len=1448 TSval=1776280679 TSecr=1644747828"
"239","9.264417","10.0.0.101","192.168.0.3","RSL","1514","5000,35644","Round Trip Delay REPort "
"240","9.264436","10.0.0.101","192.168.0.3","TCP","1514","5000,35644","5000  >  35644 [ACK] Seq=223583 Ack=11213 Win=6826 Len=1448 TSval=1776280679 TSecr=1644747828"
"241","9.264468","10.0.0.101","192.168.0.3","TCP","1514","5000,35644","5000  >  35644 [PSH, ACK] Seq=225031 Ack=11213 Win=6826 Len=1448 TSval=1776280679 TSecr=1644747828"
"242","9.264484","10.0.0.101","192.168.0.3","TCP","1514","5000,35644","5000  >  35644 [ACK] Seq=226479 Ack=11213 Win=6826 Len=1448 TSval=1776280679 TSecr=1644747828"
"243","9.264529","10.0.0.101","192.168.0.3","TCP","1514","5000,35644","5000  >  35644 [ACK] Seq=227927 Ack=11213 Win=6826 Len=1448 TSval=1776280679 TSecr=1644747828"
"244","9.264545","10.0.0.101","192.168.0.3","TCP","1514","5000,35644","5000  >  35644 [PSH, ACK] Seq=229375 Ack=11213 Win=6826 Len=1448 TSval=1776280679 TSecr=1644747828"
"245","9.264607","10.0.0.101","192.168.0.3","TCP","1514","5000,35644","5000  >  35644 [ACK] Seq=230823 Ack=11213 Win=6826 Len=1448 TSval=1776280679 TSecr=1644747828"
"246","9.264655","10.0.0.101","192.168.0.3","TCP","1514","5000,35644","5000  >  35644 [ACK] Seq=232271 Ack=11213 Win=6826 Len=1448 TSval=1776280679 TSecr=1644747828"
"247","9.264663","10.0.0.101","192.168.0.3","TCP","1514","5000,35644","5000  >  35644 [PSH, ACK] Seq=233719 Ack=11213 Win=6826 Len=1448 TSval=1776280679 TSecr=1644747828"
"248","9.264616","192.168.0.3","10.0.0.101","TCP","66","35644,5000","35644  >  5000 [ACK] Seq=11213 Ack=217791 Win=28980 Len=0 TSval=1644747849 TSecr=1776280671"
"249","9.264766","192.168.0.3","10.0.0.101","TCP","66","35644,5000","35644  >  5000 [ACK] Seq=11213 Ack=230823 Win=28872 Len=0 TSval=1644747849 TSecr=1776280679"
"250","9.264820","192.168.0.3","10.0.0.101","TCP","66","35644,5000","35644  >  5000 [ACK] Seq=11213 Ack=235167 Win=28836 Len=0 TSval=1644747849 TSecr=1776280679"
"251","9.265949","192.168.0.3","10.0.0.101","RSL","1116","35644,5000","PAGING CoMmanD "
"252","9.274697","10.0.0.101","192.168.0.3","TCP","1514","5000,35644","5000  >  35644 [ACK] Seq=235167 Ack=11213 Win=6826 Len=1448 TSval=1776280688 TSecr=1644747839"
"253","9.274717","10.0.0.101","192.168.0.3","TCP","1514","5000,35644","5000  >  35644 [ACK] Seq=236615 Ack=11213 Win=6826 Len=1448 TSval=1776280688 TSecr=1644747839"
"254","9.275068","10.0.0.101","192.168.0.3","TCP","1514","5000,35644","5000  >  35644 [PSH, ACK] Seq=238063 Ack=11213 Win=6826 Len=1448 TSval=1776280688 TSecr=1644747839"
"255","9.275087","10.0.0.101","192.168.0.3","TCP","1514","5000,35644","5000  >  35644 [ACK] Seq=239511 Ack=11213 Win=6826 Len=1448 TSval=1776280688 TSecr=1644747839"
"256","9.275095","10.0.0.101","192.168.0.3","TCP","1514","5000,35644","5000  >  35644 [PSH, ACK] Seq=240959 Ack=11213 Win=6826 Len=1448 TSval=1776280688 TSecr=1644747839"
"257","9.275117","10.0.0.101","192.168.0.3","TCP","1514","5000,35644","5000  >  35644 [ACK] Seq=242407 Ack=11213 Win=6826 Len=1448 TSval=1776280688 TSecr=1644747839"
"258","9.275128","192.168.0.3","10.0.0.101","TCP","66","35644,5000","35644  >  5000 [ACK] Seq=12263 Ack=238063 Win=28988 Len=0 TSval=1644747859 TSecr=1776280688"
"259","9.275129","10.0.0.101","192.168.0.3","TCP","1514","5000,35644","5000  >  35644 [ACK] Seq=243855 Ack=11213 Win=6826 Len=1448 TSval=1776280688 TSecr=1644747839"
"260","9.275163","10.0.0.101","192.168.0.3","TCP","1514","5000,35644","5000  >  35644 [PSH, ACK] Seq=245303 Ack=11213 Win=6826 Len=1448 TSval=1776280688 TSecr=1644747839"
"261","9.275171","10.0.0.101","192.168.0.3","TCP","1514","5000,35644","5000  >  35644 [ACK] Seq=246751 Ack=11213 Win=6826 Len=1448 TSval=1776280688 TSecr=1644747839"
"262","9.275178","10.0.0.101","192.168.0.3","RSL","1514","5000,35644","PAGING CoMmanD "
"263","9.275190","10.0.0.101","192.168.0.3","TCP","1514","5000,35644","5000  >  35644 [PSH, ACK] Seq=249647 Ack=11213 Win=6826 Len=1448 TSval=1776280688 TSecr=1644747839"
"264","9.275198","10.0.0.101","192.168.0.3","TCP","1514","5000,35644","5000  >  35644 [ACK] Seq=251095 Ack=11213 Win=6826 Len=1448 TSval=1776280688 TSecr=1644747839"
"265","9.275206","10.0.0.101","192.168.0.3","TCP","1514","5000,35644","5000  >  35644 [ACK] Seq=252543 Ack=11213 Win=6826 Len=1448 TSval=1776280688 TSecr=1644747839"
"266","9.275218","10.0.0.101","192.168.0.3","TCP","1514","5000,35644","5000  >  35644 [PSH, ACK] Seq=253991 Ack=11213 Win=6826 Len=1448 TSval=1776280688 TSecr=1644747839"
"267","9.275225","10.0.0.101","192.168.0.3","RSL","1514","5000,35644","ip.access MEASurement PREPROCessing DeFauLT "
"268","9.275235","10.0.0.101","192.168.0.3","TCP","1514","5000,35644","5000  >  35644 [PSH, ACK] Seq=256887 Ack=11213 Win=6826 Len=1448 TSval=1776280688 TSecr=1644747839"
"269","9.275252","192.168.0.3","10.0.0.101","TCP","66","35644,5000","35644  >  5000 [ACK] Seq=12263 Ack=242407 Win=28952 Len=0 TSval=1644747859 TSecr=1776280688"
