"No.","Time","Source","Destination","Protocol","Length","Port","Lenght TCP","Info"
"5","6.234824","192.168.0.3","10.0.0.101","RSL","602","35644,5000","536","CHANnel ReQuireD "
"6","6.248285","10.0.0.101","192.168.0.3","TCP","66","5000,35644","0","5000  >  35644 [ACK] Seq=1 Ack=537 Win=16088 Len=0 TSval=1786326572 TSecr=1654793972"
"7","6.258342","10.0.0.101","192.168.0.3","RSL","602","5000,35644","536","CHANnel ReQuireD "
"8","6.258414","192.168.0.3","10.0.0.101","TCP","66","35644,5000","0","35644  >  5000 [ACK] Seq=537 Ack=537 Win=29014 Len=0 TSval=1654793996 TSecr=1786326589"
"9","6.259100","192.168.0.3","10.0.0.101","RSL","602","35644,5000","536","CHANnel ReQuireD "
"10","6.288588","10.0.0.101","192.168.0.3","RSL","1514","5000,35644","1448","ip.access HANDOover CANDidate ENQuiry "
"11","6.288619","10.0.0.101","192.168.0.3","TCP","1514","5000,35644","1448","5000  >  35644 [PSH, ACK] Seq=1985 Ack=1073 Win=16088 Len=1448 TSval=1786326621 TSecr=1654793997"
"12","6.288640","10.0.0.101","192.168.0.3","TCP","1240","5000,35644","1174","5000  >  35644 [PSH, ACK] Seq=3433 Ack=1073 Win=16088 Len=1174 TSval=1786326621 TSecr=1654793997"
"13","6.288649","10.0.0.101","192.168.0.3","RSL","1514","5000,35644","1448","unknown 95 "
"14","6.288668","10.0.0.101","192.168.0.3","TCP","1514","5000,35644","1448","5000  >  35644 [PSH, ACK] Seq=6055 Ack=1073 Win=16088 Len=1448 TSval=1786326621 TSecr=1654793997"
"15","6.288745","192.168.0.3","10.0.0.101","TCP","66","35644,5000","0","35644  >  5000 [ACK] Seq=1073 Ack=3433 Win=28992 Len=0 TSval=1654794026 TSecr=1786326621"
"16","6.288761","192.168.0.3","10.0.0.101","TCP","66","35644,5000","0","35644  >  5000 [ACK] Seq=1073 Ack=4607 Win=28980 Len=0 TSval=1654794026 TSecr=1786326621"
"17","6.288769","192.168.0.3","10.0.0.101","TCP","66","35644,5000","0","35644  >  5000 [ACK] Seq=1073 Ack=7503 Win=28956 Len=0 TSval=1654794026 TSecr=1786326621"
"18","6.308843","10.0.0.101","192.168.0.3","TCP","854","5000,35644","788","5000  >  35644 [PSH, ACK] Seq=7503 Ack=1073 Win=16088 Len=788 TSval=1786326633 TSecr=1654794026"
"19","6.308868","10.0.0.101","192.168.0.3","RSL","1514","5000,35644","1448","ip.access HANDOover CANDidate ENQuiry "
"20","6.308884","10.0.0.101","192.168.0.3","TCP","1514","5000,35644","1448","5000  >  35644 [PSH, ACK] Seq=9739 Ack=1073 Win=16088 Len=1448 TSval=1786326635 TSecr=1654794026"
"21","6.308904","10.0.0.101","192.168.0.3","TCP","1514","5000,35644","1448","5000  >  35644 [ACK] Seq=11187 Ack=1073 Win=16088 Len=1448 TSval=1786326635 TSecr=1654794026"
"22","6.308951","10.0.0.101","192.168.0.3","TCP","1514","5000,35644","1448","5000  >  35644 [PSH, ACK] Seq=12635 Ack=1073 Win=16088 Len=1448 TSval=1786326635 TSecr=1654794026"
"23","6.308976","10.0.0.101","192.168.0.3","TCP","1514","5000,35644","1448","5000  >  35644 [ACK] Seq=14083 Ack=1073 Win=16088 Len=1448 TSval=1786326635 TSecr=1654794026"
"24","6.308980","192.168.0.3","10.0.0.101","TCP","66","35644,5000","0","35644  >  5000 [ACK] Seq=1073 Ack=8291 Win=29000 Len=0 TSval=1654794046 TSecr=1786326633"
"25","6.308995","192.168.0.3","10.0.0.101","TCP","66","35644,5000","0","35644  >  5000 [ACK] Seq=1073 Ack=11187 Win=28976 Len=0 TSval=1654794046 TSecr=1786326635"
"26","6.309002","192.168.0.3","10.0.0.101","TCP","66","35644,5000","0","35644  >  5000 [ACK] Seq=1073 Ack=12635 Win=28964 Len=0 TSval=1654794046 TSecr=1786326635"
"27","6.309032","192.168.0.3","10.0.0.101","TCP","66","35644,5000","0","35644  >  5000 [ACK] Seq=1073 Ack=14083 Win=28952 Len=0 TSval=1654794046 TSecr=1786326635"
"28","6.309049","192.168.0.3","10.0.0.101","TCP","66","35644,5000","0","35644  >  5000 [ACK] Seq=1073 Ack=15531 Win=28940 Len=0 TSval=1654794047 TSecr=1786326635"
"29","6.319053","10.0.0.101","192.168.0.3","TCP","1514","5000,35644","1448","5000  >  35644 [ACK] Seq=15531 Ack=1073 Win=16088 Len=1448 TSval=1786326644 TSecr=1654794026"
"30","6.319069","10.0.0.101","192.168.0.3","TCP","1514","5000,35644","1448","5000  >  35644 [PSH, ACK] Seq=16979 Ack=1073 Win=16088 Len=1448 TSval=1786326644 TSecr=1654794026"
"31","6.319101","10.0.0.101","192.168.0.3","TCP","1514","5000,35644","1448","5000  >  35644 [ACK] Seq=18427 Ack=1073 Win=16088 Len=1448 TSval=1786326644 TSecr=1654794026"
"32","6.319163","192.168.0.3","10.0.0.101","TCP","66","35644,5000","0","35644  >  5000 [ACK] Seq=1073 Ack=18427 Win=28992 Len=0 TSval=1654794057 TSecr=1786326644"
"33","6.319189","192.168.0.3","10.0.0.101","TCP","66","35644,5000","0","35644  >  5000 [ACK] Seq=1073 Ack=19875 Win=28980 Len=0 TSval=1654794057 TSecr=1786326644"
"34","6.329219","10.0.0.101","192.168.0.3","TCP","1514","5000,35644","1448","5000  >  35644 [ACK] Seq=19875 Ack=1073 Win=16088 Len=1448 TSval=1786326653 TSecr=1654794046"
"35","6.329252","10.0.0.101","192.168.0.3","TCP","1514","5000,35644","1448","5000  >  35644 [PSH, ACK] Seq=21323 Ack=1073 Win=16088 Len=1448 TSval=1786326653 TSecr=1654794046"
"36","6.329265","10.0.0.101","192.168.0.3","TCP","1514","5000,35644","1448","5000  >  35644 [ACK] Seq=22771 Ack=1073 Win=16088 Len=1448 TSval=1786326653 TSecr=1654794046"
"37","6.329293","10.0.0.101","192.168.0.3","TCP","1514","5000,35644","1448","5000  >  35644 [PSH, ACK] Seq=24219 Ack=1073 Win=16088 Len=1448 TSval=1786326653 TSecr=1654794046"
"38","6.329332","192.168.0.3","10.0.0.101","TCP","66","35644,5000","0","35644  >  5000 [ACK] Seq=1073 Ack=22771 Win=28992 Len=0 TSval=1654794067 TSecr=1786326653"
"39","6.329346","192.168.0.3","10.0.0.101","TCP","66","35644,5000","0","35644  >  5000 [ACK] Seq=1073 Ack=24219 Win=28980 Len=0 TSval=1654794067 TSecr=1786326653"
"40","6.329335","10.0.0.101","192.168.0.3","TCP","1514","5000,35644","1448","5000  >  35644 [ACK] Seq=25667 Ack=1073 Win=16088 Len=1448 TSval=1786326653 TSecr=1654794047"
"41","6.329368","192.168.0.3","10.0.0.101","TCP","66","35644,5000","0","35644  >  5000 [ACK] Seq=1073 Ack=25667 Win=28968 Len=0 TSval=1654794067 TSecr=1786326653"
"42","6.329394","10.0.0.101","192.168.0.3","TCP","1514","5000,35644","1448","5000  >  35644 [PSH, ACK] Seq=27115 Ack=1073 Win=16088 Len=1448 TSval=1786326653 TSecr=1654794047"
"43","6.329417","10.0.0.101","192.168.0.3","TCP","1000","5000,35644","934","5000  >  35644 [PSH, ACK] Seq=28563 Ack=1073 Win=16088 Len=934 TSval=1786326653 TSecr=1654794047"
"44","6.329418","192.168.0.3","10.0.0.101","TCP","66","35644,5000","0","35644  >  5000 [ACK] Seq=1073 Ack=27115 Win=28956 Len=0 TSval=1654794067 TSecr=1786326653"
"45","6.329483","192.168.0.3","10.0.0.101","TCP","66","35644,5000","0","35644  >  5000 [ACK] Seq=1073 Ack=29497 Win=28932 Len=0 TSval=1654794067 TSecr=1786326653"
"46","6.330445","192.168.0.3","10.0.0.101","RSL","602","35644,5000","536","CHANnel ReQuireD "
"47","6.389777","10.0.0.101","192.168.0.3","TCP","66","5000,35644","0","5000  >  35644 [ACK] Seq=29497 Ack=1609 Win=16088 Len=0 TSval=1786326714 TSecr=1654794068"
"48","6.389857","192.168.0.3","10.0.0.101","RSL","1116","35644,5000","1050","PAGING CoMmanD "
"49","6.419988","10.0.0.101","192.168.0.3","RSL","602","5000,35644","536","CHANnel ReQuireD "
"50","6.420102","192.168.0.3","10.0.0.101","TCP","66","35644,5000","0","35644  >  5000 [ACK] Seq=2659 Ack=30033 Win=29022 Len=0 TSval=1654794158 TSecr=1786326751"
"51","6.422150","192.168.0.3","10.0.0.101","RSL","602","35644,5000","536","CHANnel ReQuireD "
"52","6.440132","10.0.0.101","192.168.0.3","TCP","66","5000,35644","0","5000  >  35644 [ACK] Seq=30033 Ack=3195 Win=16088 Len=0 TSval=1786326764 TSecr=1654794160"
"53","6.450209","10.0.0.101","192.168.0.3","RSL","1514","5000,35644","1448","NOTification CoMmanD "
"54","6.450230","10.0.0.101","192.168.0.3","TCP","1514","5000,35644","1448","5000  >  35644 [PSH, ACK] Seq=31481 Ack=3195 Win=16088 Len=1448 TSval=1786326781 TSecr=1654794160"
"55","6.450255","10.0.0.101","192.168.0.3","TCP","790","5000,35644","724","5000  >  35644 [PSH, ACK] Seq=32929 Ack=3195 Win=16088 Len=724 TSval=1786326781 TSecr=1654794160"
"56","6.450333","192.168.0.3","10.0.0.101","TCP","66","35644,5000","0","35644  >  5000 [ACK] Seq=3195 Ack=33653 Win=28976 Len=0 TSval=1654794188 TSecr=1786326781"
"57","6.470413","10.0.0.101","192.168.0.3","RSL","1514","5000,35644","1448","ip.access HANDOover CANDidate ENQuiry "
"58","6.470432","10.0.0.101","192.168.0.3","TCP","1514","5000,35644","1448","5000  >  35644 [PSH, ACK] Seq=35101 Ack=3195 Win=16088 Len=1448 TSval=1786326795 TSecr=1654794188"
"59","6.470453","10.0.0.101","192.168.0.3","RSL","1240","5000,35644","1174","unknown 124 "
"60","6.470491","10.0.0.101","192.168.0.3","RSL","1514","5000,35644","1448","unknown 95 "
"61","6.470501","10.0.0.101","192.168.0.3","TCP","1514","5000,35644","1448","5000  >  35644 [PSH, ACK] Seq=39171 Ack=3195 Win=16088 Len=1448 TSval=1786326795 TSecr=1654794188"
"62","6.470514","192.168.0.3","10.0.0.101","TCP","66","35644,5000","0","35644  >  5000 [ACK] Seq=3195 Ack=36549 Win=28992 Len=0 TSval=1654794208 TSecr=1786326795"
"63","6.470583","192.168.0.3","10.0.0.101","TCP","66","35644,5000","0","35644  >  5000 [ACK] Seq=3195 Ack=40619 Win=28956 Len=0 TSval=1654794208 TSecr=1786326795"
"64","6.480604","10.0.0.101","192.168.0.3","RSL","1514","5000,35644","1448","unknown 88 "
"65","6.480620","10.0.0.101","192.168.0.3","TCP","1514","5000,35644","1448","5000  >  35644 [PSH, ACK] Seq=42067 Ack=3195 Win=16088 Len=1448 TSval=1786326805 TSecr=1654794188"
"66","6.480676","192.168.0.3","10.0.0.101","TCP","66","35644,5000","0","35644  >  5000 [ACK] Seq=3195 Ack=43515 Win=28992 Len=0 TSval=1654794218 TSecr=1786326805"
"67","6.490716","10.0.0.101","192.168.0.3","TCP","1064","5000,35644","998","5000  >  35644 [PSH, ACK] Seq=43515 Ack=3195 Win=16088 Len=998 TSval=1786326815 TSecr=1654794208"
"68","6.497584","192.168.0.3","10.0.0.101","RSL","602","35644,5000","536","CHANnel ReQuireD "
"69","6.520940","10.0.0.101","192.168.0.3","RSL","1116","5000,35644","1050","PAGING CoMmanD "
"70","6.525998","192.168.0.3","10.0.0.101","RSL","602","35644,5000","536","CHANnel ReQuireD "
"71","6.551156","10.0.0.101","192.168.0.3","RSL Cell Broadcast","1514","5000,35644","1448","SMS BroadCast CoMmanD  (CBS Page)"
"72","6.551173","10.0.0.101","192.168.0.3","RSL","1514","5000,35644","1448","RELease INDication "
"73","6.551186","10.0.0.101","192.168.0.3","TCP","276","5000,35644","210","5000  >  35644 [PSH, ACK] Seq=48459 Ack=4267 Win=16088 Len=210 TSval=1786326882 TSecr=1654794263"
"74","6.551279","192.168.0.3","10.0.0.101","TCP","66","35644,5000","0","35644  >  5000 [ACK] Seq=4267 Ack=48669 Win=28980 Len=0 TSval=1654794289 TSecr=1786326882"
"75","6.556455","192.168.0.3","10.0.0.101","RSL","602","35644,5000","536","CHANnel ReQuireD "
"76","6.581407","10.0.0.101","192.168.0.3","RSL","602","5000,35644","536","CHANnel ReQuireD "
"77","6.586373","192.168.0.3","10.0.0.101","RSL","602","35644,5000","536","CHANnel ReQuireD "
"78","6.611592","10.0.0.101","192.168.0.3","RSL","1514","5000,35644","1448","OVERLOAD "
"79","6.611611","10.0.0.101","192.168.0.3","TCP","1210","5000,35644","1144","5000  >  35644 [PSH, ACK] Seq=50653 Ack=5339 Win=16088 Len=1144 TSval=1786326943 TSecr=1654794324"
"80","6.611708","192.168.0.3","10.0.0.101","TCP","66","35644,5000","0","35644  >  5000 [ACK] Seq=5339 Ack=51797 Win=28992 Len=0 TSval=1654794349 TSecr=1786326943"
"81","6.616879","192.168.0.3","10.0.0.101","RSL","602","35644,5000","536","CHANnel ReQuireD "
"82","6.641824","10.0.0.101","192.168.0.3","RSL","1514","5000,35644","1448","NOTification CoMmanD "
"83","6.641849","10.0.0.101","192.168.0.3","TCP","1514","5000,35644","1448","5000  >  35644 [PSH, ACK] Seq=53245 Ack=5875 Win=16088 Len=1448 TSval=1786326973 TSecr=1654794354"
"84","6.641857","10.0.0.101","192.168.0.3","TCP","790","5000,35644","724","5000  >  35644 [PSH, ACK] Seq=54693 Ack=5875 Win=16088 Len=724 TSval=1786326973 TSecr=1654794354"
"85","6.641965","192.168.0.3","10.0.0.101","TCP","66","35644,5000","0","35644  >  5000 [ACK] Seq=5875 Ack=55417 Win=28980 Len=0 TSval=1654794379 TSecr=1786326973"
"86","6.642324","192.168.0.3","10.0.0.101","RSL","602","35644,5000","536","CHANnel ReQuireD "
"87","6.651920","10.0.0.101","192.168.0.3","RSL CBCH","1514","5000,35644","1448","SMS BroadCast REQuest "
"88","6.661996","10.0.0.101","192.168.0.3","TCP","182","5000,35644","116","5000  >  35644 [PSH, ACK] Seq=56865 Ack=5875 Win=16088 Len=116 TSval=1786326986 TSecr=1654794379"
"89","6.662078","192.168.0.3","10.0.0.101","TCP","66","35644,5000","0","35644  >  5000 [ACK] Seq=6411 Ack=56981 Win=29022 Len=0 TSval=1654794400 TSecr=1786326982"
"90","6.702224","10.0.0.101","192.168.0.3","TCP","66","5000,35644","0","5000  >  35644 [ACK] Seq=56981 Ack=6411 Win=16088 Len=0 TSval=1786327030 TSecr=1654794380"
"91","6.702300","192.168.0.3","10.0.0.101","RSL","602","35644,5000","536","CHANnel ReQuireD "
"92","6.732445","10.0.0.101","192.168.0.3","RSL","1514","5000,35644","1448","NOTification CoMmanD "
"93","6.732461","10.0.0.101","192.168.0.3","TCP","1514","5000,35644","1448","5000  >  35644 [PSH, ACK] Seq=58429 Ack=6947 Win=16088 Len=1448 TSval=1786327064 TSecr=1654794440"
"94","6.732484","10.0.0.101","192.168.0.3","TCP","790","5000,35644","724","5000  >  35644 [PSH, ACK] Seq=59877 Ack=6947 Win=16088 Len=724 TSval=1786327064 TSecr=1654794440"
"95","6.732589","192.168.0.3","10.0.0.101","TCP","66","35644,5000","0","35644  >  5000 [ACK] Seq=6947 Ack=60601 Win=29022 Len=0 TSval=1654794470 TSecr=1786327064"
"96","6.752595","10.0.0.101","192.168.0.3","RSL","1514","5000,35644","1448","ip.access HANDOover CANDidate ENQuiry "
"97","6.752612","10.0.0.101","192.168.0.3","TCP","1514","5000,35644","1448","5000  >  35644 [PSH, ACK] Seq=62049 Ack=6947 Win=16088 Len=1448 TSval=1786327079 TSecr=1654794470"
"98","6.752637","10.0.0.101","192.168.0.3","RSL","1240","5000,35644","1174","unknown 88 "
"99","6.752646","10.0.0.101","192.168.0.3","RSL","1514","5000,35644","1448","unknown 95 "
"100","6.752654","10.0.0.101","192.168.0.3","TCP","1514","5000,35644","1448","5000  >  35644 [PSH, ACK] Seq=66119 Ack=6947 Win=16088 Len=1448 TSval=1786327079 TSecr=1654794470"
"101","6.752718","192.168.0.3","10.0.0.101","TCP","66","35644,5000","0","35644  >  5000 [ACK] Seq=6947 Ack=67567 Win=28956 Len=0 TSval=1654794490 TSecr=1786327079"
"102","6.772797","10.0.0.101","192.168.0.3","IPA","854","5000,35644","788","MGCP (old) "
"103","6.797432","192.168.0.3","10.0.0.101","RSL","602","35644,5000","536","CHANnel ReQuireD "
"104","6.823110","10.0.0.101","192.168.0.3","RSL","1514","5000,35644","1448","NOTification CoMmanD "
"105","6.823127","10.0.0.101","192.168.0.3","TCP","1514","5000,35644","1448","5000  >  35644 [PSH, ACK] Seq=69803 Ack=7483 Win=16088 Len=1448 TSval=1786327155 TSecr=1654794535"
"106","6.823140","10.0.0.101","192.168.0.3","TCP","790","5000,35644","724","5000  >  35644 [PSH, ACK] Seq=71251 Ack=7483 Win=16088 Len=724 TSval=1786327155 TSecr=1654794535"
"107","6.823246","192.168.0.3","10.0.0.101","TCP","66","35644,5000","0","35644  >  5000 [ACK] Seq=7483 Ack=71975 Win=28980 Len=0 TSval=1654794561 TSecr=1786327155"
"108","6.833199","10.0.0.101","192.168.0.3","RSL","1514","5000,35644","1448","ip.access HANDOover CANDidate ENQuiry "
"109","6.833215","10.0.0.101","192.168.0.3","TCP","1514","5000,35644","1448","5000  >  35644 [PSH, ACK] Seq=73423 Ack=7483 Win=16088 Len=1448 TSval=1786327164 TSecr=1654794535"
"110","6.833280","192.168.0.3","10.0.0.101","TCP","66","35644,5000","0","35644  >  5000 [ACK] Seq=7483 Ack=74871 Win=28992 Len=0 TSval=1654794571 TSecr=1786327164"
"111","6.843288","10.0.0.101","192.168.0.3","TCP","1326","5000,35644","1260","5000  >  35644 [PSH, ACK] Seq=74871 Ack=7483 Win=16088 Len=1260 TSval=1786327167 TSecr=1654794561"
"112","6.843303","10.0.0.101","192.168.0.3","RSL","1514","5000,35644","1448","ip.access HANDOover CANDidate ENQuiry "
"113","6.843317","10.0.0.101","192.168.0.3","TCP","1514","5000,35644","1448","5000  >  35644 [PSH, ACK] Seq=77579 Ack=7483 Win=16088 Len=1448 TSval=1786327174 TSecr=1654794561"
"114","6.843337","10.0.0.101","192.168.0.3","TCP","1514","5000,35644","1448","5000  >  35644 [ACK] Seq=79027 Ack=7483 Win=16088 Len=1448 TSval=1786327174 TSecr=1654794561"
"115","6.843405","192.168.0.3","10.0.0.101","TCP","66","35644,5000","0","35644  >  5000 [ACK] Seq=7483 Ack=80475 Win=28968 Len=0 TSval=1654794581 TSecr=1786327167"
"116","6.843846","192.168.0.3","10.0.0.101","RSL","602","35644,5000","536","CHANnel ReQuireD "
"117","6.863472","10.0.0.101","192.168.0.3","TCP","392","5000,35644","326","5000  >  35644 [PSH, ACK] Seq=80475 Ack=7483 Win=16088 Len=326 TSval=1786327187 TSecr=1654794581"
"118","6.903690","10.0.0.101","192.168.0.3","TCP","66","5000,35644","0","5000  >  35644 [ACK] Seq=80801 Ack=8019 Win=16088 Len=0 TSval=1786327230 TSecr=1654794581"
"119","6.903753","192.168.0.3","10.0.0.101","RSL","1138","35644,5000","1072","CHANnel ReQuireD "
"120","6.933884","10.0.0.101","192.168.0.3","RSL","1514","5000,35644","1448","NOTification CoMmanD "
"121","6.933902","10.0.0.101","192.168.0.3","TCP","1514","5000,35644","1448","5000  >  35644 [PSH, ACK] Seq=82249 Ack=9091 Win=16088 Len=1448 TSval=1786327265 TSecr=1654794641"
"122","6.933919","10.0.0.101","192.168.0.3","TCP","790","5000,35644","724","5000  >  35644 [PSH, ACK] Seq=83697 Ack=9091 Win=16088 Len=724 TSval=1786327265 TSecr=1654794641"
"123","6.933996","192.168.0.3","10.0.0.101","TCP","66","35644,5000","0","35644  >  5000 [ACK] Seq=9091 Ack=83697 Win=28988 Len=0 TSval=1654794671 TSecr=1786327265"
"124","6.954059","10.0.0.101","192.168.0.3","RSL","1514","5000,35644","1448","OVERLOAD "
"125","6.954128","192.168.0.3","10.0.0.101","TCP","66","35644,5000","0","35644  >  5000 [ACK] Seq=9091 Ack=85869 Win=29004 Len=0 TSval=1654794692 TSecr=1786327265"
"126","6.974184","10.0.0.101","192.168.0.3","TCP","1210","5000,35644","1144","5000  >  35644 [PSH, ACK] Seq=85869 Ack=9091 Win=16088 Len=1144 TSval=1786327298 TSecr=1654794692"
"127","6.980677","192.168.0.3","10.0.0.101","RSL","602","35644,5000","536","CHANnel ReQuireD "
"128","7.004393","10.0.0.101","192.168.0.3","RSL","1514","5000,35644","1448","NOTification CoMmanD "
"129","7.004408","10.0.0.101","192.168.0.3","RSL","1514","5000,35644","1448","ESTablish CONFirm "
"130","7.004414","10.0.0.101","192.168.0.3","SCCP (Int. ITU)","790","5000,35644","724","Unknown: 224 "
"131","7.004495","192.168.0.3","10.0.0.101","TCP","66","35644,5000","0","35644  >  5000 [ACK] Seq=9627 Ack=89909 Win=28992 Len=0 TSval=1654794742 TSecr=1786327336"
"132","7.024546","10.0.0.101","192.168.0.3","RSL","1514","5000,35644","1448","ip.access HANDOover CANDidate ENQuiry "
"133","7.024562","10.0.0.101","192.168.0.3","TCP","1514","5000,35644","1448","5000  >  35644 [PSH, ACK] Seq=92081 Ack=9627 Win=16088 Len=1448 TSval=1786327351 TSecr=1654794742"
"134","7.024569","10.0.0.101","192.168.0.3","TCP","1514","5000,35644","1448","5000  >  35644 [ACK] Seq=93529 Ack=9627 Win=16088 Len=1448 TSval=1786327351 TSecr=1654794742"
"135","7.024598","10.0.0.101","192.168.0.3","TCP","1514","5000,35644","1448","5000  >  35644 [PSH, ACK] Seq=94977 Ack=9627 Win=16088 Len=1448 TSval=1786327351 TSecr=1654794742"
"136","7.024622","10.0.0.101","192.168.0.3","TCP","1514","5000,35644","1448","5000  >  35644 [ACK] Seq=96425 Ack=9627 Win=16088 Len=1448 TSval=1786327351 TSecr=1654794742"
"137","7.024645","192.168.0.3","10.0.0.101","TCP","66","35644,5000","0","35644  >  5000 [ACK] Seq=9627 Ack=93529 Win=28992 Len=0 TSval=1654794762 TSecr=1786327336"
"138","7.024922","192.168.0.3","10.0.0.101","TCP","66","35644,5000","0","35644  >  5000 [ACK] Seq=9627 Ack=96425 Win=29004 Len=0 TSval=1654794762 TSecr=1786327351"
"139","7.044754","10.0.0.101","192.168.0.3","TCP","580","5000,35644","514","5000  >  35644 [PSH, ACK] Seq=97873 Ack=9627 Win=16088 Len=514 TSval=1786327369 TSecr=1654794762"
"140","7.044813","192.168.0.3","10.0.0.101","TCP","66","35644,5000","0","35644  >  5000 [ACK] Seq=9627 Ack=98387 Win=29004 Len=0 TSval=1654794782 TSecr=1786327351"
"141","7.068621","192.168.0.3","10.0.0.101","RSL","602","35644,5000","536","CHANnel ReQuireD "
"142","7.125230","10.0.0.101","192.168.0.3","TCP","66","5000,35644","0","5000  >  35644 [ACK] Seq=98387 Ack=10163 Win=16088 Len=0 TSval=1786327450 TSecr=1654794806"
"143","7.937808","192.168.0.3","10.0.0.101","RSL","602","35644,5000","536","CHANnel ReQuireD "
"144","7.949709","10.0.0.101","192.168.0.3","TCP","66","5000,35644","0","5000  >  35644 [ACK] Seq=98387 Ack=10699 Win=16088 Len=0 TSval=1786328274 TSecr=1654795675"
"145","7.949726","10.0.0.101","192.168.0.3","RSL","602","5000,35644","536","CHANnel ReQuireD "
"146","7.950961","192.168.0.3","10.0.0.101","RSL","602","35644,5000","536","CHANnel ReQuireD "
"147","7.969879","10.0.0.101","192.168.0.3","TCP","66","5000,35644","0","5000  >  35644 [ACK] Seq=98923 Ack=11235 Win=16088 Len=0 TSval=1786328294 TSecr=1654795688"
"148","7.969895","10.0.0.101","192.168.0.3","RSL","1514","5000,35644","1448","RF RESource INDication "
"149","7.969911","10.0.0.101","192.168.0.3","TCP","696","5000,35644","630","5000  >  35644 [PSH, ACK] Seq=100371 Ack=11235 Win=16088 Len=630 TSval=1786328294 TSecr=1654795688"
"150","7.969987","192.168.0.3","10.0.0.101","TCP","66","35644,5000","0","35644  >  5000 [ACK] Seq=11235 Ack=101001 Win=28992 Len=0 TSval=1654795707 TSecr=1786328294"
"151","7.990044","10.0.0.101","192.168.0.3","RSL","602","5000,35644","536","CHANnel ReQuireD "
"153","8.030253","192.168.0.3","10.0.0.101","TCP","66","35644,5000","0","35644  >  5000 [ACK] Seq=11235 Ack=101537 Win=29022 Len=0 TSval=1654795768 TSecr=1786328314"
"155","10.392466","10.0.0.101","192.168.0.3","RSL","602","5000,35644","536","CHANnel ReQuireD "
"156","10.392594","192.168.0.3","10.0.0.101","TCP","66","35644,5000","0","35644  >  5000 [ACK] Seq=11235 Ack=102073 Win=29014 Len=0 TSval=1654798130 TSecr=1786330726"
