"No.","Time","Source","Destination","Protocol","Length","Port","Lenght TCP","Info"
"1","0.000000","c4:01:c4:42:f1:02","Spanning-tree-(for-bridges)_00","STP","60","","","Conf. Root = 32768/0/c4:01:57:d8:00:00  Cost = 0  Port = 0x802b"
"2","0.154473","10.0.0.101","192.168.0.3","RSL","602","5000,35644","536","CHANnel ReQuireD "
"3","0.197053","192.168.0.3","10.0.0.101","TCP","66","35644,5000","0","35644  >  5000 [ACK] Seq=1 Ack=537 Win=29004 Len=0 TSval=1653503940 TSecr=1785036487"
"4","2.000595","c4:01:c4:42:f1:02","Spanning-tree-(for-bridges)_00","STP","60","","","Conf. Root = 32768/0/c4:01:57:d8:00:00  Cost = 0  Port = 0x802b"
"5","4.001187","c4:01:c4:42:f1:02","Spanning-tree-(for-bridges)_00","STP","60","","","Conf. Root = 32768/0/c4:01:57:d8:00:00  Cost = 0  Port = 0x802b"
"6","6.001806","c4:01:c4:42:f1:02","Spanning-tree-(for-bridges)_00","STP","60","","","Conf. Root = 32768/0/c4:01:57:d8:00:00  Cost = 0  Port = 0x802b"
"7","7.457228","192.168.0.3","10.0.0.101","RSL","602","35644,5000","536","CHANnel ReQuireD "
"8","7.473665","10.0.0.101","192.168.0.3","TCP","66","5000,35644","0","5000  >  35644 [ACK] Seq=537 Ack=537 Win=16084 Len=0 TSval=1785043801 TSecr=1653511200"
"9","8.002355","c4:01:c4:42:f1:02","Spanning-tree-(for-bridges)_00","STP","60","","","Conf. Root = 32768/0/c4:01:57:d8:00:00  Cost = 0  Port = 0x802b"
"10","8.746008","192.168.0.3","10.0.0.101","RSL","602","35644,5000","536","CHANnel ReQuireD "
"11","8.760379","10.0.0.101","192.168.0.3","TCP","66","5000,35644","0","5000  >  35644 [ACK] Seq=537 Ack=1073 Win=16088 Len=0 TSval=1785045088 TSecr=1653512489"
"12","8.770472","10.0.0.101","192.168.0.3","RSL","602","5000,35644","536","CHANnel ReQuireD "
"13","8.770573","192.168.0.3","10.0.0.101","TCP","66","35644,5000","0","35644  >  5000 [ACK] Seq=1073 Ack=1073 Win=29004 Len=0 TSval=1653512513 TSecr=1785045104"
"14","8.771246","192.168.0.3","10.0.0.101","RSL","602","35644,5000","536","CHANnel ReQuireD "
"15","8.790606","10.0.0.101","192.168.0.3","TCP","66","5000,35644","0","5000  >  35644 [ACK] Seq=1073 Ack=1609 Win=16088 Len=0 TSval=1785045118 TSecr=1653512514"
"16","8.800692","10.0.0.101","192.168.0.3","RSL","1514","5000,35644","1448","ip.access HANDOover CANDidate ENQuiry "
"17","8.800720","10.0.0.101","192.168.0.3","TCP","1514","5000,35644","1448","5000  >  35644 [PSH, ACK] Seq=2521 Ack=1609 Win=16088 Len=1448 TSval=1785045135 TSecr=1653512514"
"18","8.800727","10.0.0.101","192.168.0.3","TCP","1240","5000,35644","1174","5000  >  35644 [PSH, ACK] Seq=3969 Ack=1609 Win=16088 Len=1174 TSval=1785045135 TSecr=1653512514"
"19","8.800738","10.0.0.101","192.168.0.3","RSL","1514","5000,35644","1448","unknown 95 "
"20","8.800746","10.0.0.101","192.168.0.3","TCP","1514","5000,35644","1448","5000  >  35644 [PSH, ACK] Seq=6591 Ack=1609 Win=16088 Len=1448 TSval=1785045135 TSecr=1653512514"
"21","8.800789","192.168.0.3","10.0.0.101","TCP","66","35644,5000","0","35644  >  5000 [ACK] Seq=1609 Ack=3969 Win=28992 Len=0 TSval=1653512543 TSecr=1785045135"
"22","8.800799","192.168.0.3","10.0.0.101","TCP","66","35644,5000","0","35644  >  5000 [ACK] Seq=1609 Ack=5143 Win=28980 Len=0 TSval=1653512544 TSecr=1785045135"
"23","8.801110","192.168.0.3","10.0.0.101","TCP","66","35644,5000","0","35644  >  5000 [ACK] Seq=1609 Ack=8039 Win=28992 Len=0 TSval=1653512544 TSecr=1785045135"
"24","8.810835","10.0.0.101","192.168.0.3","TCP","1514","5000,35644","1448","5000  >  35644 [ACK] Seq=8039 Ack=1609 Win=16088 Len=1448 TSval=1785045147 TSecr=1653512514"
"25","8.810870","10.0.0.101","192.168.0.3","RSL","1514","5000,35644","1448","unknown 110 "
"26","8.810954","192.168.0.3","10.0.0.101","TCP","66","35644,5000","0","35644  >  5000 [ACK] Seq=1609 Ack=9487 Win=29004 Len=0 TSval=1653512554 TSecr=1785045147"
"27","8.811005","10.0.0.101","192.168.0.3","TCP","1514","5000,35644","1448","5000  >  35644 [ACK] Seq=10935 Ack=1609 Win=16088 Len=1448 TSval=1785045147 TSecr=1653512514"
"28","8.811014","10.0.0.101","192.168.0.3","TCP","1514","5000,35644","1448","5000  >  35644 [ACK] Seq=12383 Ack=1609 Win=16088 Len=1448 TSval=1785045147 TSecr=1653512514"
"29","8.811029","10.0.0.101","192.168.0.3","TCP","1514","5000,35644","1448","5000  >  35644 [PSH, ACK] Seq=13831 Ack=1609 Win=16088 Len=1448 TSval=1785045147 TSecr=1653512514"
"30","8.811075","192.168.0.3","10.0.0.101","TCP","66","35644,5000","0","35644  >  5000 [ACK] Seq=1609 Ack=10935 Win=28986 Len=0 TSval=1653512554 TSecr=1785045147"
"31","8.811088","192.168.0.3","10.0.0.101","TCP","66","35644,5000","0","35644  >  5000 [ACK] Seq=1609 Ack=12383 Win=28964 Len=0 TSval=1653512554 TSecr=1785045147"
"32","8.811097","192.168.0.3","10.0.0.101","TCP","66","35644,5000","0","35644  >  5000 [ACK] Seq=1609 Ack=13831 Win=28976 Len=0 TSval=1653512554 TSecr=1785045147"
"33","8.811123","192.168.0.3","10.0.0.101","TCP","66","35644,5000","0","35644  >  5000 [ACK] Seq=1609 Ack=15279 Win=28964 Len=0 TSval=1653512554 TSecr=1785045147"
"34","8.821052","10.0.0.101","192.168.0.3","RSL","1368","5000,35644","1302","ip.access HANDOover CANDidate RESPonse "
"35","8.821131","192.168.0.3","10.0.0.101","TCP","66","35644,5000","0","35644  >  5000 [ACK] Seq=1609 Ack=16581 Win=29004 Len=0 TSval=1653512564 TSecr=1785045149"
"36","8.831182","10.0.0.101","192.168.0.3","RSL","1514","5000,35644","1448","ip.access HANDOover CANDidate ENQuiry "
"37","8.831204","10.0.0.101","192.168.0.3","IPA","1514","5000,35644","1448","MGCP (old) "
"38","8.831223","10.0.0.101","192.168.0.3","TCP","1514","5000,35644","1448","5000  >  35644 [ACK] Seq=19477 Ack=1609 Win=16088 Len=1448 TSval=1785045160 TSecr=1653512554"
"39","8.831255","10.0.0.101","192.168.0.3","TCP","1514","5000,35644","1448","5000  >  35644 [PSH, ACK] Seq=20925 Ack=1609 Win=16088 Len=1448 TSval=1785045160 TSecr=1653512554"
"40","8.831276","192.168.0.3","10.0.0.101","TCP","66","35644,5000","0","35644  >  5000 [ACK] Seq=1609 Ack=19477 Win=28992 Len=0 TSval=1653512574 TSecr=1785045159"
"41","8.831280","10.0.0.101","192.168.0.3","TCP","1514","5000,35644","1448","5000  >  35644 [ACK] Seq=22373 Ack=1609 Win=16088 Len=1448 TSval=1785045160 TSecr=1653512554"
"42","8.831294","192.168.0.3","10.0.0.101","TCP","66","35644,5000","0","35644  >  5000 [ACK] Seq=1609 Ack=20925 Win=28980 Len=0 TSval=1653512574 TSecr=1785045160"
"43","8.831320","192.168.0.3","10.0.0.101","TCP","66","35644,5000","0","35644  >  5000 [ACK] Seq=1609 Ack=22373 Win=28968 Len=0 TSval=1653512574 TSecr=1785045160"
"44","8.831349","192.168.0.3","10.0.0.101","TCP","66","35644,5000","0","35644  >  5000 [ACK] Seq=1609 Ack=23821 Win=28956 Len=0 TSval=1653512574 TSecr=1785045160"
"45","8.841376","10.0.0.101","192.168.0.3","TCP","580","5000,35644","514","5000  >  35644 [PSH, ACK] Seq=23821 Ack=1609 Win=16088 Len=514 TSval=1785045169 TSecr=1653512564"
"46","8.841391","10.0.0.101","192.168.0.3","RSL","1514","5000,35644","1448","ip.access HANDOover CANDidate ENQuiry "
"47","8.841419","10.0.0.101","192.168.0.3","TCP","1514","5000,35644","1448","5000  >  35644 [PSH, ACK] Seq=25783 Ack=1609 Win=16088 Len=1448 TSval=1785045171 TSecr=1653512564"
"48","8.841456","10.0.0.101","192.168.0.3","RSL","1514","5000,35644","1448","CBCH LOAD INDication "
"49","8.841471","192.168.0.3","10.0.0.101","TCP","66","35644,5000","0","35644  >  5000 [ACK] Seq=1609 Ack=24335 Win=29004 Len=0 TSval=1653512584 TSecr=1785045169"
"50","8.841483","10.0.0.101","192.168.0.3","TCP","1514","5000,35644","1448","5000  >  35644 [PSH, ACK] Seq=28679 Ack=1609 Win=16088 Len=1448 TSval=1785045171 TSecr=1653512564"
"51","8.841556","10.0.0.101","192.168.0.3","TCP","1514","5000,35644","1448","5000  >  35644 [ACK] Seq=30127 Ack=1609 Win=16088 Len=1448 TSval=1785045171 TSecr=1653512564"
"52","8.841576","10.0.0.101","192.168.0.3","TCP","1514","5000,35644","1448","5000  >  35644 [ACK] Seq=31575 Ack=1609 Win=16088 Len=1448 TSval=1785045171 TSecr=1653512564"
"53","8.841585","10.0.0.101","192.168.0.3","RSL Cell Broadcast","1514","5000,35644","1448","SMS BroadCast CoMmanD  (CBS Page)"
"54","8.841562","192.168.0.3","10.0.0.101","TCP","66","35644,5000","0","35644  >  5000 [ACK] Seq=1609 Ack=30127 Win=28956 Len=0 TSval=1653512584 TSecr=1785045171"
"55","8.841672","192.168.0.3","10.0.0.101","TCP","66","35644,5000","0","35644  >  5000 [ACK] Seq=1609 Ack=34471 Win=28920 Len=0 TSval=1653512584 TSecr=1785045171"
"56","8.841682","10.0.0.101","192.168.0.3","TCP","1514","5000,35644","1448","5000  >  35644 [ACK] Seq=34471 Ack=1609 Win=16088 Len=1448 TSval=1785045171 TSecr=1653512564"
"57","8.841700","10.0.0.101","192.168.0.3","RSL","1514","5000,35644","1448","RELease REQuest "
"58","8.841709","10.0.0.101","192.168.0.3","TCP","1514","5000,35644","1448","5000  >  35644 [PSH, ACK] Seq=37367 Ack=1609 Win=16088 Len=1448 TSval=1785045171 TSecr=1653512564"
"59","8.841721","10.0.0.101","192.168.0.3","TCP","1514","5000,35644","1448","5000  >  35644 [ACK] Seq=38815 Ack=1609 Win=16088 Len=1448 TSval=1785045171 TSecr=1653512564"
"60","8.841807","192.168.0.3","10.0.0.101","TCP","66","35644,5000","0","35644  >  5000 [ACK] Seq=1609 Ack=38815 Win=28980 Len=0 TSval=1653512584 TSecr=1785045171"
"61","8.842589","192.168.0.3","10.0.0.101","RSL","602","35644,5000","536","CHANnel ReQuireD "
"62","8.861870","10.0.0.101","192.168.0.3","TCP","1232","5000,35644","1166","5000  >  35644 [PSH, ACK] Seq=40263 Ack=1609 Win=16088 Len=1166 TSval=1785045189 TSecr=1653512584"
"63","8.861891","10.0.0.101","192.168.0.3","RSL","1514","5000,35644","1448","ip.access HANDOover CANDidate ENQuiry "
"64","8.861906","10.0.0.101","192.168.0.3","TCP","1514","5000,35644","1448","5000  >  35644 [PSH, ACK] Seq=42877 Ack=2145 Win=16088 Len=1448 TSval=1785045197 TSecr=1653512585"
"65","8.861914","10.0.0.101","192.168.0.3","RSL","1514","5000,35644","1448","ip.access CRCX ACK "
"66","8.861951","10.0.0.101","192.168.0.3","TCP","1514","5000,35644","1448","5000  >  35644 [ACK] Seq=45773 Ack=2145 Win=16088 Len=1448 TSval=1785045197 TSecr=1653512585"
"67","8.861984","10.0.0.101","192.168.0.3","TCP","1514","5000,35644","1448","5000  >  35644 [PSH, ACK] Seq=47221 Ack=2145 Win=16088 Len=1448 TSval=1785045197 TSecr=1653512585"
"68","8.861994","10.0.0.101","192.168.0.3","OML","1514","5000,35644","1448","OML "
"69","8.862009","192.168.0.3","10.0.0.101","RSL","602","35644,5000","536","CHANnel ReQuireD "
"70","8.862016","10.0.0.101","192.168.0.3","TCP","1514","5000,35644","1448","5000  >  35644 [ACK] Seq=50117 Ack=2145 Win=16088 Len=1448 TSval=1785045197 TSecr=1653512585"
"71","8.862066","192.168.0.3","10.0.0.101","TCP","66","35644,5000","0","35644  >  5000 [ACK] Seq=2681 Ack=50117 Win=28928 Len=0 TSval=1653512605 TSecr=1785045197"
"72","8.862071","10.0.0.101","192.168.0.3","TCP","1514","5000,35644","1448","5000  >  35644 [PSH, ACK] Seq=51565 Ack=2145 Win=16088 Len=1448 TSval=1785045197 TSecr=1653512585"
"73","8.862108","10.0.0.101","192.168.0.3","TCP","1514","5000,35644","1448","5000  >  35644 [ACK] Seq=53013 Ack=2145 Win=16088 Len=1448 TSval=1785045197 TSecr=1653512585"
"74","8.862123","10.0.0.101","192.168.0.3","TCP","1514","5000,35644","1448","5000  >  35644 [ACK] Seq=54461 Ack=2145 Win=16088 Len=1448 TSval=1785045197 TSecr=1653512585"
"75","8.862137","10.0.0.101","192.168.0.3","RSL","1514","5000,35644","1448","RF RESource INDication "
"76","8.862169","10.0.0.101","192.168.0.3","TCP","1514","5000,35644","1448","5000  >  35644 [ACK] Seq=57357 Ack=2145 Win=16088 Len=1448 TSval=1785045197 TSecr=1653512585"
"77","8.862214","10.0.0.101","192.168.0.3","TCP","1514","5000,35644","1448","5000  >  35644 [ACK] Seq=58805 Ack=2145 Win=16088 Len=1448 TSval=1785045197 TSecr=1653512585"
"78","8.862228","10.0.0.101","192.168.0.3","TCP","1514","5000,35644","1448","5000  >  35644 [PSH, ACK] Seq=60253 Ack=2145 Win=16088 Len=1448 TSval=1785045197 TSecr=1653512585"
"79","8.862243","10.0.0.101","192.168.0.3","RSL","1514","5000,35644","1448","unknown 79 "
"80","8.862745","192.168.0.3","10.0.0.101","TCP","66","35644,5000","0","35644  >  5000 [ACK] Seq=2681 Ack=63149 Win=28820 Len=0 TSval=1653512605 TSecr=1785045197"
"81","8.872333","10.0.0.101","192.168.0.3","TCP","1514","5000,35644","1448","5000  >  35644 [PSH, ACK] Seq=63149 Ack=2145 Win=16088 Len=1448 TSval=1785045197 TSecr=1653512585"
"82","8.872358","10.0.0.101","192.168.0.3","TCP","1514","5000,35644","1448","5000  >  35644 [ACK] Seq=64597 Ack=2145 Win=16088 Len=1448 TSval=1785045197 TSecr=1653512585"
"83","8.872366","10.0.0.101","192.168.0.3","TCP","1514","5000,35644","1448","5000  >  35644 [ACK] Seq=66045 Ack=2145 Win=16088 Len=1448 TSval=1785045197 TSecr=1653512585"
"84","8.872393","10.0.0.101","192.168.0.3","IPA","1514","5000,35644","1448","HSL Debug [Malformed Packet: length of contained item exceeds length of containing item]"
"85","8.872421","10.0.0.101","192.168.0.3","TCP","1514","5000,35644","1448","5000  >  35644 [ACK] Seq=68941 Ack=2145 Win=16088 Len=1448 TSval=1785045198 TSecr=1653512585"
"86","8.872454","10.0.0.101","192.168.0.3","RSL","1514","5000,35644","1448","unknown 81 "
"87","8.872456","192.168.0.3","10.0.0.101","TCP","66","35644,5000","0","35644  >  5000 [ACK] Seq=2681 Ack=67493 Win=28980 Len=0 TSval=1653512615 TSecr=1785045197"
"88","8.872476","10.0.0.101","192.168.0.3","TCP","1514","5000,35644","1448","5000  >  35644 [PSH, ACK] Seq=71837 Ack=2145 Win=16088 Len=1448 TSval=1785045198 TSecr=1653512585"
"89","8.872505","192.168.0.3","10.0.0.101","TCP","66","35644,5000","0","35644  >  5000 [ACK] Seq=2681 Ack=70389 Win=28956 Len=0 TSval=1653512615 TSecr=1785045197"
"90","8.872509","10.0.0.101","192.168.0.3","TCP","1514","5000,35644","1448","5000  >  35644 [ACK] Seq=73285 Ack=2145 Win=16088 Len=1448 TSval=1785045198 TSecr=1653512585"
"91","8.872548","10.0.0.101","192.168.0.3","TCP","1514","5000,35644","1448","5000  >  35644 [ACK] Seq=74733 Ack=2145 Win=16088 Len=1448 TSval=1785045198 TSecr=1653512585"
"92","8.872584","10.0.0.101","192.168.0.3","TCP","1514","5000,35644","1448","5000  >  35644 [PSH, ACK] Seq=76181 Ack=2145 Win=16088 Len=1448 TSval=1785045198 TSecr=1653512585"
"93","8.872597","10.0.0.101","192.168.0.3","TCP","1514","5000,35644","1448","5000  >  35644 [ACK] Seq=77629 Ack=2145 Win=16088 Len=1448 TSval=1785045198 TSecr=1653512585"
"94","8.872620","10.0.0.101","192.168.0.3","RSL","1514","5000,35644","1448","ip.access MEASurement PREPROCessing DeFauLT "
"95","8.872655","10.0.0.101","192.168.0.3","TCP","1514","5000,35644","1448","5000  >  35644 [PSH, ACK] Seq=80525 Ack=2145 Win=16088 Len=1448 TSval=1785045198 TSecr=1653512585"
"96","8.872666","10.0.0.101","192.168.0.3","TCP","1514","5000,35644","1448","5000  >  35644 [ACK] Seq=81973 Ack=2145 Win=16088 Len=1448 TSval=1785045198 TSecr=1653512585"
"97","8.872688","10.0.0.101","192.168.0.3","TCP","1514","5000,35644","1448","5000  >  35644 [ACK] Seq=83421 Ack=2145 Win=16088 Len=1448 TSval=1785045207 TSecr=1653512585"
"98","8.872736","10.0.0.101","192.168.0.3","TCP","1514","5000,35644","1448","5000  >  35644 [ACK] Seq=84869 Ack=2145 Win=16088 Len=1448 TSval=1785045207 TSecr=1653512585"
"99","8.872868","192.168.0.3","10.0.0.101","TCP","66","35644,5000","0","35644  >  5000 [ACK] Seq=2681 Ack=86317 Win=28820 Len=0 TSval=1653512616 TSecr=1785045198"
"100","8.874164","192.168.0.3","10.0.0.101","RSL","1514","35644,5000","1448","CHANnel ReQuireD "
"101","8.882829","10.0.0.101","192.168.0.3","TCP","1514","5000,35644","1448","5000  >  35644 [PSH, ACK] Seq=86317 Ack=2145 Win=16088 Len=1448 TSval=1785045207 TSecr=1653512585"
"102","8.882847","10.0.0.101","192.168.0.3","TCP","1514","5000,35644","1448","5000  >  35644 [ACK] Seq=87765 Ack=2145 Win=16088 Len=1448 TSval=1785045207 TSecr=1653512585"
"103","8.882855","10.0.0.101","192.168.0.3","TCP","1514","5000,35644","1448","5000  >  35644 [PSH, ACK] Seq=89213 Ack=2145 Win=16088 Len=1448 TSval=1785045207 TSecr=1653512585"
"104","8.882885","10.0.0.101","192.168.0.3","TCP","1514","5000,35644","1448","5000  >  35644 [ACK] Seq=90661 Ack=2681 Win=16088 Len=1448 TSval=1785045210 TSecr=1653512605"
"105","8.882909","10.0.0.101","192.168.0.3","TCP","1514","5000,35644","1448","5000  >  35644 [ACK] Seq=92109 Ack=2681 Win=16088 Len=1448 TSval=1785045210 TSecr=1653512605"
"106","8.882931","192.168.0.3","10.0.0.101","TCP","66","35644,5000","0","35644  >  5000 [ACK] Seq=4129 Ack=90661 Win=28980 Len=0 TSval=1653512626 TSecr=1785045207"
"107","8.882937","10.0.0.101","192.168.0.3","TCP","1514","5000,35644","1448","5000  >  35644 [PSH, ACK] Seq=93557 Ack=2681 Win=16088 Len=1448 TSval=1785045210 TSecr=1653512605"
"108","8.882947","192.168.0.3","10.0.0.101","TCP","204","35644,5000","138","35644  >  5000 [PSH, ACK] Seq=4129 Ack=92109 Win=28968 Len=138 TSval=1653512626 TSecr=1785045210"
"109","8.882978","10.0.0.101","192.168.0.3","TCP","1514","5000,35644","1448","5000  >  35644 [ACK] Seq=95005 Ack=2681 Win=16088 Len=1448 TSval=1785045210 TSecr=1653512605"
"110","8.882991","10.0.0.101","192.168.0.3","TCP","1514","5000,35644","1448","5000  >  35644 [ACK] Seq=96453 Ack=2681 Win=16088 Len=1448 TSval=1785045210 TSecr=1653512605"
"111","8.883032","192.168.0.3","10.0.0.101","TCP","66","35644,5000","0","35644  >  5000 [ACK] Seq=4267 Ack=95005 Win=28944 Len=0 TSval=1653512626 TSecr=1785045210"
"112","8.883035","10.0.0.101","192.168.0.3","TCP","1514","5000,35644","1448","5000  >  35644 [PSH, ACK] Seq=97901 Ack=2681 Win=16088 Len=1448 TSval=1785045210 TSecr=1653512605"
"113","8.883052","10.0.0.101","192.168.0.3","TCP","1514","5000,35644","1448","5000  >  35644 [ACK] Seq=99349 Ack=2681 Win=16088 Len=1448 TSval=1785045211 TSecr=1653512605"
"114","8.883065","10.0.0.101","192.168.0.3","TCP","1514","5000,35644","1448","5000  >  35644 [PSH, ACK] Seq=100797 Ack=2681 Win=16088 Len=1448 TSval=1785045211 TSecr=1653512605"
"115","8.883079","10.0.0.101","192.168.0.3","TCP","1514","5000,35644","1448","5000  >  35644 [ACK] Seq=102245 Ack=2681 Win=16088 Len=1448 TSval=1785045211 TSecr=1653512605"
"116","8.883103","192.168.0.3","10.0.0.101","TCP","66","35644,5000","0","35644  >  5000 [ACK] Seq=4267 Ack=97901 Win=28920 Len=0 TSval=1653512626 TSecr=1785045210"
"117","8.883123","10.0.0.101","192.168.0.3","RSL","1514","5000,35644","1448","unknown 91 "
"118","8.883138","10.0.0.101","192.168.0.3","OML","1514","5000,35644","1448","OML "
"119","8.883162","10.0.0.101","192.168.0.3","TCP","1514","5000,35644","1448","5000  >  35644 [ACK] Seq=106589 Ack=2681 Win=16088 Len=1448 TSval=1785045211 TSecr=1653512605"
"120","8.883172","10.0.0.101","192.168.0.3","TCP","1514","5000,35644","1448","5000  >  35644 [ACK] Seq=108037 Ack=2681 Win=16088 Len=1448 TSval=1785045211 TSecr=1653512605"
"121","8.883200","192.168.0.3","10.0.0.101","TCP","66","35644,5000","0","35644  >  5000 [ACK] Seq=4267 Ack=103693 Win=28868 Len=0 TSval=1653512626 TSecr=1785045210"
"122","8.884159","192.168.0.3","10.0.0.101","TCP","66","35644,5000","0","35644  >  5000 [ACK] Seq=4267 Ack=109485 Win=28820 Len=0 TSval=1653512627 TSecr=1785045211"
"123","8.893264","10.0.0.101","192.168.0.3","TCP","1514","5000,35644","1448","5000  >  35644 [PSH, ACK] Seq=109485 Ack=2681 Win=16088 Len=1448 TSval=1785045211 TSecr=1653512605"
"124","8.893305","10.0.0.101","192.168.0.3","RSL","1514","5000,35644","1448","CHANnel ACTIVation "
"125","8.893317","10.0.0.101","192.168.0.3","TCP","1514","5000,35644","1448","5000  >  35644 [ACK] Seq=112381 Ack=2681 Win=16088 Len=1448 TSval=1785045211 TSecr=1653512605"
"126","8.893332","10.0.0.101","192.168.0.3","TCP","1514","5000,35644","1448","5000  >  35644 [PSH, ACK] Seq=113829 Ack=2681 Win=16088 Len=1448 TSval=1785045211 TSecr=1653512605"
"127","8.893362","192.168.0.3","10.0.0.101","TCP","66","35644,5000","0","35644  >  5000 [ACK] Seq=4267 Ack=112381 Win=28992 Len=0 TSval=1653512636 TSecr=1785045211"
"128","8.893397","192.168.0.3","10.0.0.101","TCP","66","35644,5000","0","35644  >  5000 [ACK] Seq=4267 Ack=115277 Win=28968 Len=0 TSval=1653512636 TSecr=1785045211"
"129","8.893399","10.0.0.101","192.168.0.3","TCP","1514","5000,35644","1448","5000  >  35644 [ACK] Seq=115277 Ack=2681 Win=16088 Len=1448 TSval=1785045211 TSecr=1653512605"
"130","8.893426","10.0.0.101","192.168.0.3","TCP","1514","5000,35644","1448","5000  >  35644 [ACK] Seq=116725 Ack=2681 Win=16088 Len=1448 TSval=1785045211 TSecr=1653512605"
"131","8.893520","192.168.0.3","10.0.0.101","TCP","66","35644,5000","0","35644  >  5000 [ACK] Seq=4267 Ack=118173 Win=28992 Len=0 TSval=1653512636 TSecr=1785045211"
"132","8.893566","10.0.0.101","192.168.0.3","TCP","1514","5000,35644","1448","5000  >  35644 [PSH, ACK] Seq=118173 Ack=2681 Win=16088 Len=1448 TSval=1785045211 TSecr=1653512605"
"133","8.893579","10.0.0.101","192.168.0.3","RSL","1514","5000,35644","1448","unknown 84 "
"134","8.893594","10.0.0.101","192.168.0.3","TCP","132","5000,35644","66","5000  >  35644 [PSH, ACK] Seq=121069 Ack=2681 Win=16088 Len=66 TSval=1785045211 TSecr=1653512605"
"135","8.893602","10.0.0.101","192.168.0.3","RSL","1514","5000,35644","1448","ip.access HANDOover CANDidate ENQuiry "
"136","8.893612","10.0.0.101","192.168.0.3","TCP","1514","5000,35644","1448","5000  >  35644 [PSH, ACK] Seq=122583 Ack=2681 Win=16088 Len=1448 TSval=1785045219 TSecr=1653512605"
"137","8.893747","192.168.0.3","10.0.0.101","TCP","66","35644,5000","0","35644  >  5000 [ACK] Seq=4267 Ack=124031 Win=28932 Len=0 TSval=1653512636 TSecr=1785045211"
"138","8.903600","10.0.0.101","192.168.0.3","TCP","66","5000,35644","0","5000  >  35644 [ACK] Seq=124031 Ack=4267 Win=16088 Len=0 TSval=1785045231 TSecr=1653512617"
"139","8.903618","10.0.0.101","192.168.0.3","RSL","1514","5000,35644","1448","PHYsical CONTEXT REQuest "
"140","8.903627","10.0.0.101","192.168.0.3","TCP","1514","5000,35644","1448","5000  >  35644 [ACK] Seq=125479 Ack=4267 Win=16088 Len=1448 TSval=1785045232 TSecr=1653512627"
"141","8.903635","10.0.0.101","192.168.0.3","TCP","1514","5000,35644","1448","5000  >  35644 [PSH, ACK] Seq=126927 Ack=4267 Win=16088 Len=1448 TSval=1785045232 TSecr=1653512627"
"142","8.903670","10.0.0.101","192.168.0.3","TCP","1514","5000,35644","1448","5000  >  35644 [ACK] Seq=128375 Ack=4267 Win=16088 Len=1448 TSval=1785045232 TSecr=1653512627"
"143","8.903681","10.0.0.101","192.168.0.3","TCP","1514","5000,35644","1448","5000  >  35644 [ACK] Seq=129823 Ack=4267 Win=16088 Len=1448 TSval=1785045232 TSecr=1653512627"
"144","8.903701","10.0.0.101","192.168.0.3","TCP","1514","5000,35644","1448","5000  >  35644 [PSH, ACK] Seq=131271 Ack=4267 Win=16088 Len=1448 TSval=1785045232 TSecr=1653512627"
"145","8.903705","192.168.0.3","10.0.0.101","RSL","602","35644,5000","536","CHANnel ReQuireD "
"146","8.903725","10.0.0.101","192.168.0.3","TCP","1514","5000,35644","1448","5000  >  35644 [ACK] Seq=132719 Ack=4267 Win=16088 Len=1448 TSval=1785045232 TSecr=1653512627"
"147","8.903757","10.0.0.101","192.168.0.3","TCP","1514","5000,35644","1448","5000  >  35644 [ACK] Seq=134167 Ack=4267 Win=16088 Len=1448 TSval=1785045232 TSecr=1653512627"
"148","8.903789","192.168.0.3","10.0.0.101","TCP","66","35644,5000","0","35644  >  5000 [ACK] Seq=4803 Ack=132719 Win=28940 Len=0 TSval=1653512646 TSecr=1785045232"
"149","8.903806","10.0.0.101","192.168.0.3","TCP","1514","5000,35644","1448","5000  >  35644 [PSH, ACK] Seq=135615 Ack=4267 Win=16088 Len=1448 TSval=1785045232 TSecr=1653512627"
"150","8.903817","10.0.0.101","192.168.0.3","TCP","1514","5000,35644","1448","5000  >  35644 [ACK] Seq=137063 Ack=4267 Win=16088 Len=1448 TSval=1785045232 TSecr=1653512627"
"151","8.903826","10.0.0.101","192.168.0.3","TCP","1514","5000,35644","1448","5000  >  35644 [ACK] Seq=138511 Ack=4267 Win=16088 Len=1448 TSval=1785045232 TSecr=1653512627"
"152","8.903864","10.0.0.101","192.168.0.3","TCP","1514","5000,35644","1448","5000  >  35644 [PSH, ACK] Seq=139959 Ack=4267 Win=16088 Len=1448 TSval=1785045232 TSecr=1653512627"
"153","8.903877","10.0.0.101","192.168.0.3","TCP","1514","5000,35644","1448","5000  >  35644 [ACK] Seq=141407 Ack=4267 Win=16088 Len=1448 TSval=1785045232 TSecr=1653512627"
"154","8.903890","10.0.0.101","192.168.0.3","TCP","1514","5000,35644","1448","5000  >  35644 [PSH, ACK] Seq=142855 Ack=4267 Win=16088 Len=1448 TSval=1785045232 TSecr=1653512627"
"155","8.903910","10.0.0.101","192.168.0.3","RSL","1514","5000,35644","1448","unknown 84 "
"156","8.903930","192.168.0.3","10.0.0.101","TCP","66","35644,5000","0","35644  >  5000 [ACK] Seq=4803 Ack=138511 Win=28874 Len=0 TSval=1653512647 TSecr=1785045232"
"157","8.903972","192.168.0.3","10.0.0.101","TCP","66","35644,5000","0","35644  >  5000 [ACK] Seq=4803 Ack=145751 Win=28832 Len=0 TSval=1653512647 TSecr=1785045232"
"158","8.914024","10.0.0.101","192.168.0.3","TCP","1514","5000,35644","1448","5000  >  35644 [ACK] Seq=145751 Ack=4267 Win=16088 Len=1448 TSval=1785045232 TSecr=1653512627"
"159","8.914053","10.0.0.101","192.168.0.3","TCP","1514","5000,35644","1448","5000  >  35644 [PSH, ACK] Seq=147199 Ack=4267 Win=16088 Len=1448 TSval=1785045232 TSecr=1653512627"
"160","8.914068","10.0.0.101","192.168.0.3","TCP","1514","5000,35644","1448","5000  >  35644 [ACK] Seq=148647 Ack=4267 Win=16088 Len=1448 TSval=1785045232 TSecr=1653512627"
"161","8.914105","10.0.0.101","192.168.0.3","TCP","1514","5000,35644","1448","5000  >  35644 [ACK] Seq=150095 Ack=4267 Win=16088 Len=1448 TSval=1785045232 TSecr=1653512627"
"162","8.914128","10.0.0.101","192.168.0.3","TCP","1514","5000,35644","1448","5000  >  35644 [PSH, ACK] Seq=151543 Ack=4267 Win=16088 Len=1448 TSval=1785045232 TSecr=1653512627"
"163","8.914138","192.168.0.3","10.0.0.101","TCP","66","35644,5000","0","35644  >  5000 [ACK] Seq=4803 Ack=148647 Win=28992 Len=0 TSval=1653512657 TSecr=1785045232"
"164","8.914210","10.0.0.101","192.168.0.3","TCP","1514","5000,35644","1448","5000  >  35644 [ACK] Seq=152991 Ack=4267 Win=16088 Len=1448 TSval=1785045232 TSecr=1653512627"
"165","8.914231","10.0.0.101","192.168.0.3","TCP","1514","5000,35644","1448","5000  >  35644 [ACK] Seq=154439 Ack=4267 Win=16088 Len=1448 TSval=1785045232 TSecr=1653512627"
"166","8.914241","10.0.0.101","192.168.0.3","TCP","1514","5000,35644","1448","5000  >  35644 [PSH, ACK] Seq=155887 Ack=4267 Win=16088 Len=1448 TSval=1785045232 TSecr=1653512627"
"167","8.914254","10.0.0.101","192.168.0.3","TCP","1514","5000,35644","1448","5000  >  35644 [ACK] Seq=157335 Ack=4267 Win=16088 Len=1448 TSval=1785045232 TSecr=1653512627"
"168","8.914269","10.0.0.101","192.168.0.3","TCP","1514","5000,35644","1448","5000  >  35644 [ACK] Seq=158783 Ack=4267 Win=16088 Len=1448 TSval=1785045232 TSecr=1653512627"
"169","8.914212","192.168.0.3","10.0.0.101","TCP","66","35644,5000","0","35644  >  5000 [ACK] Seq=4803 Ack=151543 Win=28968 Len=0 TSval=1653512657 TSecr=1785045232"
"170","8.914296","10.0.0.101","192.168.0.3","TCP","1514","5000,35644","1448","5000  >  35644 [PSH, ACK] Seq=160231 Ack=4267 Win=16088 Len=1448 TSval=1785045232 TSecr=1653512627"
"171","8.914303","192.168.0.3","10.0.0.101","TCP","66","35644,5000","0","35644  >  5000 [ACK] Seq=4803 Ack=155887 Win=28932 Len=0 TSval=1653512657 TSecr=1785045232"
"172","8.914346","10.0.0.101","192.168.0.3","TCP","1514","5000,35644","1448","5000  >  35644 [ACK] Seq=161679 Ack=4267 Win=16088 Len=1448 TSval=1785045232 TSecr=1653512627"
"173","8.914354","192.168.0.3","10.0.0.101","TCP","66","35644,5000","0","35644  >  5000 [ACK] Seq=4803 Ack=160231 Win=28896 Len=0 TSval=1653512657 TSecr=1785045232"
"174","8.914357","10.0.0.101","192.168.0.3","TCP","1514","5000,35644","1448","5000  >  35644 [ACK] Seq=163127 Ack=4267 Win=16088 Len=1448 TSval=1785045232 TSecr=1653512627"
"175","8.914380","10.0.0.101","192.168.0.3","TCP","1514","5000,35644","1448","5000  >  35644 [PSH, ACK] Seq=164575 Ack=4267 Win=16088 Len=1448 TSval=1785045232 TSecr=1653512627"
"176","8.914408","10.0.0.101","192.168.0.3","TCP","1514","5000,35644","1448","5000  >  35644 [ACK] Seq=166023 Ack=4267 Win=16088 Len=1448 TSval=1785045232 TSecr=1653512627"
"177","8.914431","10.0.0.101","192.168.0.3","TCP","1514","5000,35644","1448","5000  >  35644 [PSH, ACK] Seq=167471 Ack=4267 Win=16088 Len=1448 TSval=1785045232 TSecr=1653512627"
"178","8.915132","192.168.0.3","10.0.0.101","TCP","66","35644,5000","0","35644  >  5000 [ACK] Seq=4803 Ack=168919 Win=28820 Len=0 TSval=1653512658 TSecr=1785045232"
"179","8.918063","192.168.0.3","10.0.0.101","RSL","1514","35644,5000","1448","CHANnel ReQuireD "
"180","8.924538","10.0.0.101","192.168.0.3","TCP","1514","5000,35644","1448","5000  >  35644 [ACK] Seq=168919 Ack=4267 Win=16088 Len=1448 TSval=1785045232 TSecr=1653512627"
"181","8.924554","10.0.0.101","192.168.0.3","TCP","1044","5000,35644","978","5000  >  35644 [PSH, ACK] Seq=170367 Ack=4267 Win=16088 Len=978 TSval=1785045242 TSecr=1653512636"
"182","8.924563","10.0.0.101","192.168.0.3","RSL","1514","5000,35644","1448","ip.access HANDOover CANDidate ENQuiry "
"183","8.924583","10.0.0.101","192.168.0.3","TCP","1514","5000,35644","1448","5000  >  35644 [PSH, ACK] Seq=172793 Ack=4267 Win=16088 Len=1448 TSval=1785045243 TSecr=1653512636"
"184","8.924597","10.0.0.101","192.168.0.3","TCP","1514","5000,35644","1448","5000  >  35644 [ACK] Seq=174241 Ack=4267 Win=16088 Len=1448 TSval=1785045243 TSecr=1653512636"
"185","8.924647","192.168.0.3","10.0.0.101","TCP","66","35644,5000","0","35644  >  5000 [ACK] Seq=6251 Ack=175689 Win=28956 Len=0 TSval=1653512667 TSecr=1785045232"
"186","8.924812","10.0.0.101","192.168.0.3","TCP","1514","5000,35644","1448","5000  >  35644 [ACK] Seq=175689 Ack=4267 Win=16088 Len=1448 TSval=1785045243 TSecr=1653512636"
"187","8.924829","10.0.0.101","192.168.0.3","TCP","1514","5000,35644","1448","5000  >  35644 [PSH, ACK] Seq=177137 Ack=4267 Win=16088 Len=1448 TSval=1785045243 TSecr=1653512636"
"188","8.924837","10.0.0.101","192.168.0.3","TCP","1514","5000,35644","1448","5000  >  35644 [ACK] Seq=178585 Ack=4267 Win=16088 Len=1448 TSval=1785045243 TSecr=1653512636"
"189","8.924849","10.0.0.101","192.168.0.3","TCP","1514","5000,35644","1448","5000  >  35644 [ACK] Seq=180033 Ack=4267 Win=16088 Len=1448 TSval=1785045243 TSecr=1653512636"
"190","8.924857","10.0.0.101","192.168.0.3","TCP","1514","5000,35644","1448","5000  >  35644 [PSH, ACK] Seq=181481 Ack=4267 Win=16088 Len=1448 TSval=1785045243 TSecr=1653512636"
"191","8.924867","10.0.0.101","192.168.0.3","TCP","1514","5000,35644","1448","5000  >  35644 [ACK] Seq=182929 Ack=4267 Win=16088 Len=1448 TSval=1785045243 TSecr=1653512636"
"192","8.924880","10.0.0.101","192.168.0.3","RSL","1514","5000,35644","1448","ip.access MDCX NACK "
"193","8.924887","10.0.0.101","192.168.0.3","OML","1514","5000,35644","1448","OML "
"194","8.924901","10.0.0.101","192.168.0.3","TCP","1514","5000,35644","1448","5000  >  35644 [ACK] Seq=187273 Ack=4267 Win=16088 Len=1448 TSval=1785045243 TSecr=1653512636"
"195","8.924908","10.0.0.101","192.168.0.3","TCP","1514","5000,35644","1448","5000  >  35644 [ACK] Seq=188721 Ack=4267 Win=16088 Len=1448 TSval=1785045243 TSecr=1653512636"
"196","8.924914","192.168.0.3","10.0.0.101","TCP","66","35644,5000","0","35644  >  5000 [ACK] Seq=6251 Ack=178585 Win=28992 Len=0 TSval=1653512668 TSecr=1785045243"
"197","8.924916","10.0.0.101","192.168.0.3","TCP","1514","5000,35644","1448","5000  >  35644 [PSH, ACK] Seq=190169 Ack=4267 Win=16088 Len=1448 TSval=1785045243 TSecr=1653512636"
"198","8.925361","192.168.0.3","10.0.0.101","TCP","66","35644,5000","0","35644  >  5000 [ACK] Seq=6251 Ack=191617 Win=28880 Len=0 TSval=1653512668 TSecr=1785045243"
"199","8.934896","10.0.0.101","192.168.0.3","TCP","1514","5000,35644","1448","5000  >  35644 [ACK] Seq=191617 Ack=4267 Win=16088 Len=1448 TSval=1785045243 TSecr=1653512636"
"200","8.934912","10.0.0.101","192.168.0.3","RSL","1514","5000,35644","1448","unknown 108 "
"201","8.934925","10.0.0.101","192.168.0.3","TCP","1514","5000,35644","1448","5000  >  35644 [ACK] Seq=194513 Ack=4803 Win=16088 Len=1448 TSval=1785045255 TSecr=1653512646"
"202","8.934946","10.0.0.101","192.168.0.3","RSL","1514","5000,35644","1448","unknown 106 "
"203","8.934978","10.0.0.101","192.168.0.3","TCP","1514","5000,35644","1448","5000  >  35644 [PSH, ACK] Seq=197409 Ack=4803 Win=16088 Len=1448 TSval=1785045255 TSecr=1653512646"
"204","8.934989","192.168.0.3","10.0.0.101","TCP","66","35644,5000","0","35644  >  5000 [ACK] Seq=6251 Ack=194513 Win=28992 Len=0 TSval=1653512678 TSecr=1785045243"
"205","8.935000","10.0.0.101","192.168.0.3","TCP","1514","5000,35644","1448","5000  >  35644 [ACK] Seq=198857 Ack=4803 Win=16088 Len=1448 TSval=1785045255 TSecr=1653512646"
"206","8.935007","192.168.0.3","10.0.0.101","TCP","1254","35644,5000","1188","35644  >  5000 [PSH, ACK] Seq=6251 Ack=195961 Win=28980 Len=1188 TSval=1653512678 TSecr=1785045255"
"207","8.935059","192.168.0.3","10.0.0.101","TCP","66","35644,5000","0","35644  >  5000 [ACK] Seq=7439 Ack=200305 Win=28944 Len=0 TSval=1653512678 TSecr=1785045255"
"208","8.935075","10.0.0.101","192.168.0.3","TCP","1514","5000,35644","1448","5000  >  35644 [ACK] Seq=200305 Ack=4803 Win=16088 Len=1448 TSval=1785045255 TSecr=1653512646"
"209","8.935091","10.0.0.101","192.168.0.3","TCP","1514","5000,35644","1448","5000  >  35644 [PSH, ACK] Seq=201753 Ack=4803 Win=16088 Len=1448 TSval=1785045255 TSecr=1653512646"
"210","8.935100","10.0.0.101","192.168.0.3","TCP","1514","5000,35644","1448","5000  >  35644 [ACK] Seq=203201 Ack=4803 Win=16088 Len=1448 TSval=1785045255 TSecr=1653512646"
"211","8.935131","10.0.0.101","192.168.0.3","TCP","1514","5000,35644","1448","5000  >  35644 [ACK] Seq=204649 Ack=4803 Win=16088 Len=1448 TSval=1785045255 TSecr=1653512646"
"212","8.935149","10.0.0.101","192.168.0.3","TCP","1514","5000,35644","1448","5000  >  35644 [PSH, ACK] Seq=206097 Ack=4803 Win=16088 Len=1448 TSval=1785045255 TSecr=1653512646"
"213","8.935157","10.0.0.101","192.168.0.3","TCP","1514","5000,35644","1448","5000  >  35644 [ACK] Seq=207545 Ack=4803 Win=16088 Len=1448 TSval=1785045255 TSecr=1653512646"
"214","8.935181","10.0.0.101","192.168.0.3","TCP","1514","5000,35644","1448","5000  >  35644 [ACK] Seq=208993 Ack=4803 Win=16088 Len=1448 TSval=1785045255 TSecr=1653512646"
"215","8.935193","192.168.0.3","10.0.0.101","TCP","66","35644,5000","0","35644  >  5000 [ACK] Seq=7439 Ack=204649 Win=28908 Len=0 TSval=1653512678 TSecr=1785045255"
"216","8.935200","10.0.0.101","192.168.0.3","TCP","1514","5000,35644","1448","5000  >  35644 [PSH, ACK] Seq=210441 Ack=4803 Win=16088 Len=1448 TSval=1785045255 TSecr=1653512646"
"217","8.935239","10.0.0.101","192.168.0.3","RSL","1514","5000,35644","1448","unknown 104 unknown 0x75 "
"218","8.935254","192.168.0.3","10.0.0.101","TCP","66","35644,5000","0","35644  >  5000 [ACK] Seq=7439 Ack=210441 Win=28860 Len=0 TSval=1653512678 TSecr=1785045255"
"219","8.935254","10.0.0.101","192.168.0.3","TCP","1514","5000,35644","1448","5000  >  35644 [PSH, ACK] Seq=213337 Ack=4803 Win=16088 Len=1448 TSval=1785045255 TSecr=1653512646"
"220","8.936091","192.168.0.3","10.0.0.101","TCP","66","35644,5000","0","35644  >  5000 [ACK] Seq=7439 Ack=214785 Win=28824 Len=0 TSval=1653512679 TSecr=1785045255"
"221","8.945346","10.0.0.101","192.168.0.3","TCP","1514","5000,35644","1448","5000  >  35644 [ACK] Seq=214785 Ack=4803 Win=16088 Len=1448 TSval=1785045255 TSecr=1653512646"
"222","8.945366","10.0.0.101","192.168.0.3","TCP","1514","5000,35644","1448","5000  >  35644 [ACK] Seq=216233 Ack=4803 Win=16088 Len=1448 TSval=1785045255 TSecr=1653512646"
"223","8.945375","10.0.0.101","192.168.0.3","RSL","1514","5000,35644","1448","unknown 95 "
"224","8.945397","10.0.0.101","192.168.0.3","TCP","1514","5000,35644","1448","5000  >  35644 [ACK] Seq=219129 Ack=6251 Win=16088 Len=1448 TSval=1785045267 TSecr=1653512661"
"225","8.945416","10.0.0.101","192.168.0.3","TCP","1514","5000,35644","1448","5000  >  35644 [ACK] Seq=220577 Ack=6251 Win=16088 Len=1448 TSval=1785045267 TSecr=1653512661"
"226","8.945441","192.168.0.3","10.0.0.101","TCP","66","35644,5000","0","35644  >  5000 [ACK] Seq=7439 Ack=219129 Win=28980 Len=0 TSval=1653512688 TSecr=1785045255"
"227","8.945464","10.0.0.101","192.168.0.3","TCP","1514","5000,35644","1448","5000  >  35644 [PSH, ACK] Seq=222025 Ack=6251 Win=16088 Len=1448 TSval=1785045267 TSecr=1653512661"
"228","8.945479","10.0.0.101","192.168.0.3","TCP","1514","5000,35644","1448","5000  >  35644 [ACK] Seq=223473 Ack=6251 Win=16088 Len=1448 TSval=1785045267 TSecr=1653512661"
"229","8.945494","10.0.0.101","192.168.0.3","TCP","1514","5000,35644","1448","5000  >  35644 [ACK] Seq=224921 Ack=6251 Win=16088 Len=1448 TSval=1785045267 TSecr=1653512661"
"230","8.945527","10.0.0.101","192.168.0.3","TCP","1514","5000,35644","1448","5000  >  35644 [PSH, ACK] Seq=226369 Ack=6251 Win=16088 Len=1448 TSval=1785045267 TSecr=1653512661"
"231","8.945542","10.0.0.101","192.168.0.3","TCP","1514","5000,35644","1448","5000  >  35644 [ACK] Seq=227817 Ack=6251 Win=16088 Len=1448 TSval=1785045267 TSecr=1653512661"
"232","8.945550","10.0.0.101","192.168.0.3","TCP","1514","5000,35644","1448","5000  >  35644 [ACK] Seq=229265 Ack=6251 Win=16088 Len=1448 TSval=1785045267 TSecr=1653512661"
"233","8.945568","10.0.0.101","192.168.0.3","RSL","1514","5000,35644","1448","DEACTIVATE SACCH "
"234","8.945597","10.0.0.101","192.168.0.3","TCP","1514","5000,35644","1448","5000  >  35644 [ACK] Seq=232161 Ack=6251 Win=16088 Len=1448 TSval=1785045267 TSecr=1653512661"
"235","8.945619","10.0.0.101","192.168.0.3","TCP","1514","5000,35644","1448","5000  >  35644 [ACK] Seq=233609 Ack=6251 Win=16088 Len=1448 TSval=1785045267 TSecr=1653512661"
"236","8.945653","10.0.0.101","192.168.0.3","TCP","1514","5000,35644","1448","5000  >  35644 [PSH, ACK] Seq=235057 Ack=6251 Win=16088 Len=1448 TSval=1785045267 TSecr=1653512661"
"237","8.945673","10.0.0.101","192.168.0.3","TCP","1514","5000,35644","1448","5000  >  35644 [ACK] Seq=236505 Ack=6251 Win=16088 Len=1448 TSval=1785045267 TSecr=1653512661"
"238","8.945718","192.168.0.3","10.0.0.101","TCP","66","35644,5000","0","35644  >  5000 [ACK] Seq=7439 Ack=235057 Win=28844 Len=0 TSval=1653512688 TSecr=1785045267"
"239","8.945782","192.168.0.3","10.0.0.101","TCP","66","35644,5000","0","35644  >  5000 [ACK] Seq=7439 Ack=237953 Win=28820 Len=0 TSval=1653512688 TSecr=1785045267"
"240","8.950680","192.168.0.3","10.0.0.101","RSL","1514","35644,5000","1448","CHANnel ReQuireD "
"241","8.955787","10.0.0.101","192.168.0.3","RSL","1514","5000,35644","1448","unknown 125 "
"242","8.955813","10.0.0.101","192.168.0.3","TCP","1514","5000,35644","1448","5000  >  35644 [PSH, ACK] Seq=239401 Ack=6251 Win=16088 Len=1448 TSval=1785045267 TSecr=1653512661"
"243","8.955828","10.0.0.101","192.168.0.3","TCP","1514","5000,35644","1448","5000  >  35644 [ACK] Seq=240849 Ack=6251 Win=16088 Len=1448 TSval=1785045268 TSecr=1653512661"
"244","8.955855","10.0.0.101","192.168.0.3","TCP","1514","5000,35644","1448","5000  >  35644 [PSH, ACK] Seq=242297 Ack=6251 Win=16088 Len=1448 TSval=1785045268 TSecr=1653512661"
"245","8.955891","10.0.0.101","192.168.0.3","TCP","1514","5000,35644","1448","5000  >  35644 [ACK] Seq=243745 Ack=6251 Win=16088 Len=1448 TSval=1785045268 TSecr=1653512661"
"246","8.955902","10.0.0.101","192.168.0.3","TCP","226","5000,35644","160","5000  >  35644 [PSH, ACK] Seq=245193 Ack=6251 Win=16088 Len=160 TSval=1785045273 TSecr=1653512667"
"247","8.955910","10.0.0.101","192.168.0.3","RSL","1514","5000,35644","1448","ip.access HANDOover CANDidate ENQuiry "
"248","8.955928","192.168.0.3","10.0.0.101","TCP","66","35644,5000","0","35644  >  5000 [ACK] Seq=8887 Ack=243745 Win=28968 Len=0 TSval=1653512699 TSecr=1785045267"
"249","8.955949","10.0.0.101","192.168.0.3","TCP","1514","5000,35644","1448","5000  >  35644 [PSH, ACK] Seq=246801 Ack=6251 Win=16088 Len=1448 TSval=1785045278 TSecr=1653512668"
"250","8.955990","10.0.0.101","192.168.0.3","TCP","1514","5000,35644","1448","5000  >  35644 [ACK] Seq=248249 Ack=6251 Win=16088 Len=1448 TSval=1785045278 TSecr=1653512668"
"251","8.955995","192.168.0.3","10.0.0.101","TCP","66","35644,5000","0","35644  >  5000 [ACK] Seq=8887 Ack=246801 Win=28932 Len=0 TSval=1653512699 TSecr=1785045268"
"252","8.956009","10.0.0.101","192.168.0.3","TCP","1514","5000,35644","1448","5000  >  35644 [ACK] Seq=249697 Ack=6251 Win=16088 Len=1448 TSval=1785045278 TSecr=1653512668"
